text	label
excel file too big , which format to convert to imporve processing time in scripting	excel
MacBook Trackpad Gestures: Move active Window	osx
How to navigate to Begining/End of a curly brace by selecting one of the braces in Visual Studio 2005.?	visual-studio
Server moved, now MS Excel 2003 queries won't work	excel
Ant-Ivy-Scala Template: any suggestions on improvements?	scala
Mac driver development	osx
Creating add-in for Excel using C#.	excel
Webserver Log Analysis	apache
Link between CCK field and view	drupal
Generate syntax-colored, hyperlinked source code from Haskell or Objective-C	haskell
How in magento add manufacturer in the URL of the product?	magento
Oracle Trigger: raise_application_error	oracle
SIGPIPE Exception	cocoa
In Magento, how can I preview a page before saving it?	magento
[easy] SVN checkout with svn protocol	svn
What are the factors to decide between using Core Data versus rolling out a custom model?	cocoa
Upload files to Sharepoint document libraries via FTP	sharepoint
Is there a Drupal module for importing text and images?	drupal
using BC dates in Drupal date field	drupal
Redirect certain requests if referer not from same page?	apache
Data streaming in Matlab with input data coming in from a C++ executable	matlab
multiple orderby in this linq code	linq
what is this widget called?	qt
Installing Svn 1.5.x on Debian Etch - Best approach?	svn
Apache log analyzer which outputs user flows	apache
Oracle 10g ODBC: SQLBindParameter(SQL_BIGINT) succeeds, SQLExecute fails, but there are no diagnostic errors	oracle
Haskell: read input character from console immediately, not after newline.	haskell
Ajax large screen refresh	ajax
Ways to call Blocks within Magento: createBlock vs Layout xml file	magento
What options do I have for LINQ projections?	linq
MVC architecture for front-end	ajax
Scala: Mutable vs. Immutable Object Performance - OutOfMemoryError	scala
Identifying Different Excel File Formats	excel
Using an enum as a mapkey results in a RAW in the database	hibernate
Expanding mySQL query to include more content	drupal
Drupal Query builder	drupal
Is there sth like Microsoft's TechNet or MSDN subcriptions for Apple, too?	osx
How to see what label color is on a file/folder from within Termnal (Mac OS X)	osx
Anybody using Qi4J	spring
"""How do I define a search scope """"Display Group"""" for a Site definition"""	sharepoint
how to manage a custom user object in session when spring security autheticates user.	spring
Bash script directory detection and creation	bash
VBA and Private Functions	excel
Is it possible to have a custom webpart listen to default SharePoint search box?	sharepoint
Freezing Row 1 and Column A at the same time	excel
Excel AVERAGEIF with TODAY() function as criteria	excel
Retrieving the associated shared service provider's name?	sharepoint
[NSView setFrame:] not working?	cocoa
not able to delete	hibernate
bash : how to use screen to have a term session used at home after work?	bash
Programming in Lua for the Mac?	osx
Spring and the anemic domain model	spring
Filter/Map composition problem Haskell	haskell
Get Hibernate transaction status	hibernate
"""Bash syntax: What is the """"<<""""?"""	bash
Is it stupid to write a large batch processing program entirely in PL/SQL?	oracle
Matlab: avoiding memory allocation in mex	matlab
Rewrite spring-security redirect URLs	spring
Scala best way of turning a Collection into a Map-by-key?	scala
Add a date picker to system.xml on custom module	magento
noClassDefFound error using Scala Plugin for Eclipse	scala
Solution: Per application, or per application suite.	visual-studio
LINQ retreive values from a table that of which fields(of a cetain column) are not equal of another table	linq
Dynamic height for AJAX Autocomplete Textbox	ajax
Can I specify a hibernate relationship with a filter?	hibernate
Is it possible to set-up a personal SVN Remote Repository which can be accessed through the Internet?	svn
Why I cannot use my apache server?	apache
Estimating a Spring/Hibernate project.	spring
Observing an NSMutableArray for insertion/removal	cocoa
DataContxet reusing connection	linq
Multiple environment (Development, Staging, Live) in Drupal	drupal
Pulling in Magento Session Information is buggy	magento
how to prevent hacking of a WP site	wordpress
Progress Bar using javascript	ajax
How to get all tables that have FKs to another table?	oracle
Matlab matrix replacement assignment gives error	matlab
Read Excel using LINQ	excel
reading password protected excel file using matlab	matlab
Unable to add a parameter to your command in Bash	bash
How to replace old ParamText/StandartAlert with newer CFString replacements?	osx
bash/sh single-quote, doublequote & backquote question	bash
VS 2005 Toolbox Messed Up	visual-studio
Why doesn't this type declaration work?	haskell
How does coding with Linq work? What happens behind the scenes?	linq
A way to add Oscommerce cart items to a Wordpress Widget	wordpress
Disable Option-Enter line breaks in NSTextField?	cocoa
Spring DI, Domain Model & best practices	spring
Problem scripting a HTML header request with netcat	bash
Bottom bar in NSWindow	cocoa
Search by category name	magento
Debugging sometimes very slow	visual-studio
Apache returns truncated image (cross posted on serverfault.com)	apache
Compiling code on an external drive	visual-studio
AJAX - Do I need to return a full HTML document on the server side?	ajax
Best way to copy of move files with Objective-C?	osx
Cocoa 10.5 multithread app runs slowly	osx
Disable/Cancel Sleep Command on MacOSX	osx
How do you transform a Linq query result to XML?	linq
When should I use $ (and can it always be replaced with parentheses)?	haskell
Version control of MDF files	visual-studio
Creating Cocoa PopUpMenus programatically and Getting code form a GUI item built with the interface builder	cocoa
identity from sql insert via jdbctemplate	spring
SEO for a Magento multilingual store	magento
Make Visual Studio's Find in Files default to the project directory?	visual-studio
Static nested class visibility issue with Scala / Java interop	scala
Customized Sharepoint List Add/Edit page is slow to load	sharepoint
Is there any advantage to use spring DataAccessExceptions instead of JPA PersistenceExceptions ?	spring
multiple session factories, one connection?	spring
After setting up the svnserve Server, what URL will the client use to access the server?	svn
Change background of QTabBar tabs using stylesheets	qt
How can other users be updated when a comment is posted, other than the author in wordpress?	wordpress
What data type do I use for an integer in SOAP XML in Cocoa?	cocoa
Haskell -- How to split a number into a list for further processing?	haskell
What are your favorite programming-related academic papers?	haskell
Programmatically marking an Oracle BPEL task complete	oracle
pbcopy does not seem to work within a gnu screen window in OSX	osx
Test if a data distribution follows a Gaussian distribution in MATLAB	matlab
Why am I getting tree conflicts in subversion?	svn
How Does WordPress Block Search Engines?	wordpress
.net solution subversion best practices?	visual-studio
Matlab: evaluate symbol expression	matlab
How to show inactive task tabs in Drupal	drupal
Using QFrame to display different panes of information?	qt
SVN: set properties on directories only	svn
Can a SharePoint list item have it's Targeted Audience calculated or otherwise automatically specified?	sharepoint
SPWorkflowTaskProperties.ExtendedProperties aren’t populating the fields in my task	sharepoint
Trouble stopping Tomcat due to apparent threading issue..	spring
"""Drupal is unable to create the """"files"""" folder (and any upload php script as well)"""	drupal
MatLab (martix concetenating)	matlab
Hibernate-like framework for C++	hibernate
Best Scala imitation of Groovy's safe-dereference operator (?.)?	scala
Fba roles with SharePoint user groups	sharepoint
List all leaf subdirectories in linux	bash
Sidebar Behaves Differently on Wordpress Archive Pages	wordpress
Change the order of the 'Search this site' form in Drupal	drupal
Use NSArrayController with nested NSMutableArrays (Cocoa Bindings Question)	cocoa
Processing a log to fix a malformed IP address ?.?.?.x	bash
Has anyone here worked on KOFAX-SharePoint 2007 integration?	sharepoint
Checking if a folder exists (and creating folders) in Qt, C++	qt
replace a particular value in a string of key - values	bash
Matlab GPU acceleration for loading large point cloud dataset	matlab
Is there a better way to get sub-sequences where each item matches a predicate?	linq
Wordpress MU themes and Plugins	wordpress
Wordprss permalinks set	wordpress
Oracle Check Constraint	oracle
two arrays defining 2d coordinates, as array indices, in matlab/octave	matlab
What is your favourite WordPress theme framework?	wordpress
Which pattern does Hibernate follow?	hibernate
Determine a process's architecture	osx
What's an easy way to obtain the current svn revision in a c++ visual studio application	svn
Is the following utility class thread-safe?	spring
What are the best features of Scala?	scala
Cannot see my wordpress website on google search	wordpress
Haskell Pattern Matching on the Empty Set	haskell
Can i run a script when i commit to subversion?	svn
How to add Windows Mobile 6.1 image to VS 2008 Device Emulator Manager ?	visual-studio
Using PL/SQL how do you I get a file's contents in to a blob?	oracle
Apache LogFormat IP Address	apache
Hibernate3: Self-Referencing Objects	hibernate
Where is the sample applications in the lastest Spring release(Spring Framework 3.0.2)?	spring
Error while loading FastCGI module in apache 2.2	apache
Redirecting from pubilc_html to public_html/new/	apache
Optional parameters with named query in Hibernate?	hibernate
Instance of fractional [Char] required for definition?	haskell
Calculating hdiutil's compression ratio	osx
What features in Qt do you like the most?	qt
Spring Hello World setup and code in eclipse	spring
CheckBox in tableview	cocoa
Differentiating Between an AJAX Call / Browser Request	ajax
Can Ruby on Rails connect to Oracle/RDB on Mac OS X or Windows?	oracle
how can I search an svn repository for the existance of files in any revision	svn
OSX: Environment variables pointing to application bundles?	osx
How to get unique First Letter of names and count of names starting with that letter from SQL Server using LINQ?	linq
how to simple add an object to a collection in hibernate from client	hibernate
Scala: can't write setter without getter?	scala
how to iterate in snap framework without cabal install	haskell
how templates work on wordpress?	wordpress
Apache mod-proxy load balancer maintenance	apache
Dealing with incremental server response in AJAX (in JavaScript)	ajax
Wierd date and time formating in Wordpress %Y/%m/%d	wordpress
My Spring AOP not working	spring
Loading my private key for use in git on Mac	osx
"""""""Magento Tax Zones & Rates"""": how to incorporate store location and price dependencies for Tax Rates"""	magento
"""Magento - use an alternate """"price.phtml"""" (in addition to the existing one)"""	magento
Drupal View display - setting a limit for the query results	drupal
Order of svn diff revision range	svn
automatically processing contents of <textarea> without user pressing a button	ajax
Qt: Is is possible to get the QScriptEngine from QWebFrame?	qt
Bash script for manual routes and default gateway problem	bash
Mixing Static Strings with Views Arguments	drupal
Linq - Excluding items from different list types.	linq
Creating symbolic links to branches in SVN?	svn
A Maven2 mojo that uses Hibernate: how to control logging?	hibernate
Niewbie OutOfMemory problem	scala
"""Question on Scala Closure (From """"Programming in Scala"""")"""	scala
Is Sharepoin Server mandatory for Excel Services or Excel Web Access	sharepoint
How do you deal with multiple open files of the same name in VisualStudio?	visual-studio
Scala API design; a service which returns a Set<I> where I is some interface (abstract/trait)	scala
XAMPP on Falshdrive cannot start Apache, MYSQL on WIndows 7	apache
"""Scala errors in Eclipse 3.5 using Scala 2.8.0b, """"Syntax error on token String"""""""	scala
Debugging NSObjectInaccessibleException - The NSManagedObject with ID:0x123456789  has been invalidated	osx
Apache, IIS... Server Explanation for a newbie	apache
read more link in post is not working wordpress	wordpress
Magento - Changes to Edit Account Information screen do not get reflected	magento
Designing sharepoint pages - what can I use?	sharepoint
Magento design possible in all pages?	magento
awkward monad transformer stack	haskell
Accessing Excel data source running SSIS package on 64 bit server	excel
how covert post into othe language in wordpress?	wordpress
adding price rules to magento products	magento
"""is this true? """"Gzipped items will not have the same etags (even if the content did not change)"""""""	apache
How to create a custom EL expression handling regime for jBPM	spring
"""Is there any way to programmatically """"move"""" an oracle table definition from one database to another?"""	oracle
removing some rows based on criteria - solving this by pivot tables	excel
Problems with Scala Swing library	scala
Disable Trinidad skins	apache
How to find & fix memleaks inside Apache + PHP + Win2k3	apache
Matlab deployment: add files to source control?	matlab
Remove Single Quotes From All Cells in a DataTable - Creating New Table - Using LINQ in Vb.Net	linq
How can I reset addAttributeToFilter in Magento searches	magento
AJAX boardgame runs fine in Windows, but not in Linux - PROGRAMMING QUESTION	ajax
Confusion with ContT, callCC, when ...	haskell
What is the most common feature that demands the use of Visual Studio Professional over Standard?	visual-studio
QObject::findChild returns wrong address when used with a custom widget plugin	qt
Pull data from WordPress	wordpress
No error message available, result code: E_FAIL(0x80004005)	excel
Syntax for a single-line BASH infinite while loop	bash
Why does Visual Studio 2005/2008 keep 'forgetting' to color code and format?	visual-studio
Using matlab and Time Series object (fints), how can I make an array of them?	matlab
Magento - how to create different prices for different sizes of a products?	magento
Sharepoint as template application	sharepoint
A project with output type of class library cannot be started directly - with a startup exe	visual-studio
Moving a directory atomically	bash
It seems the mode rewrite in .htaccess apache is not working	apache
Load SWF inside NSView	cocoa
Write a linq expression to select a subtree of items	linq
MySQL and Matlab	matlab
Remove CA from before teh $ in magento	magento
SharePoint Infrastructure Upgrade - whoops	sharepoint
Svn organisation problem	svn
Is there a way in Matlab using the psuedo number generator to generate numbers within a specific range?	matlab
Optimization settings in VS	visual-studio
displaying a Drupal view without a page template around it	drupal
Assigning random colors per session, for chat	ajax
Apache & JBoss use port 80 at the same time	apache
How to alter sharepoint workflow task status?	sharepoint
Define Self referencing scala class(recrusive class)	scala
reversing rows in excel formulas	excel
determine whether matlab license is server- or user-based	matlab
Magento API Uploaded products not appearing in frontend - Unless they are re-saved in backend.	magento
Can I make an embedded Hibernate entity non-nullable?	hibernate
SharePoint 2007 Publishing site with deep menu structure	sharepoint
Diagnostic output of the Oracle Query Optimizer	oracle
Compression of content on Apache and Tomcat	apache
Ajax request parametors, what am I doign wrong?	ajax
Microsft Enterprise Search - FAST	sharepoint
Newsletter Signup on CMS page in Magento	magento
Plot Overlay Matlab	matlab
VS2008: Launching the executable for a project that isn't the active project in a solution	visual-studio
How can I give alternative names to new objects created by LINQ?	linq
Haskell type cast problem	haskell
Is LINQ (or linq) a niche tool, or is it on the path to becoming foundational?	linq
"""How do I display breadcrumbs on """"Products tagged with"""" pages in Magento?"""	magento
How mature is PHP:SVN	svn
how to secure AJAX interface accepting GET requests.	ajax
On MAC O.S., how to get the name of files that has been dropped onto apple script to boot JAR with the name of file as a argument to JAR	osx
Checking if a matlab handle is a valid one	matlab
[Drupal] How do i give a specific user editing rights to a specific node?	drupal
Using Haskell's types to replace assert statements or if checks in other languages	haskell
Is there a tool to convert a .vim colour definition file to use in VS.NET 2008	visual-studio
Why is Qt looking for my slot in the base class instead of derived one?	qt
Why should I NOT use the /optimize switch to compile my C# code?	visual-studio
Fatal error: Call to a member function setActive() on a non-object	magento
Excel changes date formats	excel
issue in ajax modal pop up control when  used  witih listbox  control[which is of  a javascript]	ajax
Excel: need help with unusual lookup function (sorted column is different from lookup column)	excel
QT Repaint/Redraw/Update/Do Something!	qt
Why is it allowed to write to / on MacOSX as normal user?	osx
Draw a textured triangle (patch) in Matlab	matlab
What programming task provided your breakthrough with monads?	haskell
Spring application root variable	spring
CSS breaks in Explorer (insert humor here)	wordpress
Excel Print Worksheets by Name	excel
What's an easy way to access prebuild macros such as $(SolutionDir) and $(DevEnvDir) from code in C#?	visual-studio
adding other files to haskell	haskell
Is there a good reference for how Grails was architected with Spring?	spring
Compiling Matlab to C# Problem: fatal error C1083: Cannot open include file: 'windows.h'	matlab
"""apache: cgi links lead to a """"you have chosen to open foo.cgi"""", although scriptalias is set"""	apache
Is there an example on how to use Spring 3.0 content negotiation for RESTful services?	spring
Drupal Views (Page) Using Human-Friendly Path	drupal
drawbacks of linq	linq
Matlab matrix translation and rotation multiple times	matlab
"""Is do-notation specific to """"base:GHC.Base.Monad""""?"""	haskell
What are the exact versions of stuff you have to install in order to be able to step-debug a Scala program?	scala
Best branching stragetgy when doing continuous integration?	svn
Cannot update document property on ItemAdded event when using Vista	sharepoint
QT 4.5 - how do I perform a queued connection with a template type?	qt
The Current State Of Serving a PHP 5.x App on the Apache, LightTPD & Nginx Web Servers?	apache
Running a command with every svn commit	svn
Haskell recursive problem, tiny parser. Negation of Expr and let expressions	haskell
Nested Linq crashes intellisense	linq
Is it possible to integrate ajax toolkit into mvc appliocations?	ajax
Problem executing excel from C# Application	excel
Service activator method mapping using @Header annotation in Spring Integration	spring
map (key ,value)	hibernate
Streaming Video In Scala Designer 5	scala
Why oracle does not have autoincrement feature for primary keys?	oracle
Haskell function composition (forward pipe) - why does this work?	haskell
In bash, how can I print the first n elements of a list?	bash
Strategy in the design and coding of wordpress themes?	wordpress
Best way to encapsulate complex Oracle PL/SQL cursor logic as a view?	oracle
Get the indices of the n largest elements in a matrix	matlab
I want to create a form in share point that allows the booking of time on a timetable	sharepoint
Why does my content change when running in Apache XAMPP?	apache
Wordpress blog page	wordpress
Mutable list or array structure in Bash? How can I easily append to it?	bash
Display posts from x cat and y tag	wordpress
"""Bash Scripting """" [!: not found """" errors, and how to write an or statement"""	bash
TortoiseSVN can't connect to machine in workgroup	svn
"""WordPress: I got rid of the second """"home"""" page, but it's not good enough"""	wordpress
What setting might be causing an AMP server to only allow 1 request at a time per browser?	apache
Linq to Sql Deferred Loading	linq
generating nicely formatted excel files in ASP.net without having Excel on server	excel
Select Rows from a DataSet using LINQ, where the list of RowsID's are in a List<T>	linq
Notifying subclass of QAbstractItemModel about changes	qt
How would the conversion of a custom CMS using a text-file-based database to Drupal be tackled?	drupal
"""In Haskell, what does it mean if a binding """"shadows an existing binding""""?"""	haskell
Apple PhotoSearch Example Code - Need Help.	cocoa
how to use ajax datepicker in vb.net 2.0	ajax
Java Class file from SVN to Tomcat on server: How to compile automatically?	svn
linq cache and disposing datacontext	linq
Magento category display problem on homepage on the left and right column	magento
Linq Newbie. Can I write this Linq query more concise?	linq
Any feeback on the lib Ajax-Cross-Domain and the Jquery patch  ?	ajax
Cell Array appending in Matlab.	matlab
Mod rewriting? slash to subdomain possible?	apache
Wrapping Current Category Text with Span in Wordpress	wordpress
How can hibernate access a private field ?	hibernate
how to execute haskell program in cygwin	haskell
Best Spring/Hibernate configuration for never changing tables	spring
Spring AOP Pointcut syntax for AND, OR and NOT	spring
Synchronizing Sharepoint and Active Directory Groups?	sharepoint
To use or not to use the user module	drupal
Creating multiple forms in one jsp file. ModelAttributes have to always be set?	spring
WCF service with Qt?	qt
Default radio button not triggering an UpdateControl postback	ajax
Linq returning list of anonymous types	linq
Credit card processing between Magento & Oracle	magento
Moving sharepoint installation to a different port / URL	sharepoint
How can I edit a specific item on my website's front page on Magento	magento
Signals dont get emitted	qt
When using cvs2svn how can you rename symbols such that a branch and tag resolve to the same name?	svn
Wordpress Widget Redirect Page	wordpress
"""Visual Studio Addin Development - How to resolve the """"The process cannot access the file"""" problem after exiting visual studio?"""	visual-studio
Word press - Changed directory and images do not appear	wordpress
On a Mac, within the shell, how can I tell that I have a GUI?	osx
HQL Order by qurey giving problem	hibernate
Get WordPress Post ID from Post title	wordpress
How to configure something like phpmyadmin in windows and linux?	apache
Matlab. Heart filter	matlab
Which CMS do I need? Needs to be easy to post a certain kind of post	wordpress
trying to find the comment hook I need for wordpress?	wordpress
What are the most valuable parts of Computer Science studies for Cocoa developers?	cocoa
Lift and Eclipse RCP Integration	scala
Library for browser based outliner	ajax
Getting Apache to execute command on every page view	apache
Delete all but the 4 newest directories	bash
Show Category Image with Link in Magento	magento
why is Ajax.Autocompleter setting the style for the div container for the results to display:none ?	ajax
How to run processes piped with bash on multiple cores?	bash
pipelines vs for	bash
Silently modifying nodes	drupal
What good are right-associative methods in Scala?	scala
How long do the magento session files need to be kept?	magento
Custom cases of product in Magento?	magento
How do I write StoredProcedure sub-classes to call Oracle functions?	spring
How to pass HTTP AUTH values via prototype Ajax.Request()?	ajax
DESCRIBE via database link?	oracle
Run a method on all objects within a collection	linq
Magento - Edit sidebar naviagtion on Customer's Account dashboard	magento
How to define accessor method for default constructor parameter?	scala
Suggestions for Fun Web Programming Projects at Home	apache
Spring beans redefinition in unit test environment	spring
How to additionaly filter list of published nodes in Drupal 6	drupal
How to get Tomcat Working on WIndows 7?	apache
user group gets page access	magento
Feeding a SharePoint Document Library Documents Stored on a Network Share	sharepoint
Optimizing an ORM-based model post-launch	hibernate
link error when using boost library on MacOSX	osx
Scala: How can I implement a clone method on a superclass, and use it in a subclass?	scala
Haskell type families and dummy arguments	haskell
Parsing xls with groups	excel
Linq Extension methods vs Linq syntax	linq
QT Eclipse Integration - Adding External Libs	qt
Excel hangs when printing the first time from ASP.NET webservice	excel
Failed to get separate instances of a class under mod_python	apache
Auto Refresh Wordpress Post Div	wordpress
Accessing List Images	sharepoint
Qt widget update later but when?	qt
Can I unite matlab and autocad into one system	matlab
Oracle: Combine multiple results in a subquery into a single comma-separated value	oracle
Stop echoing ^C to terminal	bash
CGLIB proxy error after spring bean definition loading into XmlWebApplicationContext at runtime	spring
Compiling MatLab 2009b applications to Windows Executables	matlab
Moving MOSS Shared Service Provider	sharepoint
Possible Wordpress URL rewriting issue	wordpress
Explain Plan Cost vs Execution Time	oracle
nswindowcontroller	cocoa
Matlab - Find  point of intersection between two vectors	matlab
Running a Javascript command from Matlab to fetch a PDF file	matlab
Oracle compile view sql	oracle
Blog wordpress-moveble type	wordpress
Haskell Parse Paragraph and em element with Parsec	haskell
ORM for ASP.net, ORACLE, looking for a solution.	oracle
DB backup problem with Spring/Hibernate GenerationType.AUTO	spring
Migrating to Team System from SVN & Cruise Control.NET and back	svn
Getting data back AND $POSTing data using jQuery.Ajax	ajax
Scala 2D Animation library	scala
Hibernate Immutable Value Object	hibernate
