text	label
Scala Regex Multiple Block Capturing	scala
HQL 1 to many count() question	hibernate
scala syntax highlighting in bluefish	scala
Weird bindings issue	cocoa
Why this keyboard intercepting kernel extension doesn't work?	osx
test sending emails from SharePoint without smtp server	sharepoint
Typed FP: Tuple Arguments and Curriable Arguments	haskell
Do I still need to learn about managing memory now that Objective-C/Cocoa has Garbage collection?	cocoa
"""Wordpress: wpdb->insert VERSUS wpdb->prepare(wpdb->query(""""INSERT..."""	wordpress
Translate Spring XML configuration to Java config	spring
Magento - Display Same Block Multiple Times on CMS Page	magento
How do I switch external css files with ajax?	ajax
Can Scala survive without corporate backing?	scala
Handling metacharacters in search strings	bash
Sql server Newbie needs help	excel
Automatically add some Where clauses to a Linq Expression Tree	linq
"""How to get a Wordpress widget to """"remember"""" values."""	wordpress
Cabal and zlib on OS X	haskell
Controlling the order of QObject children (possible workaround?)	qt
Inserting into Oracle the wrong way - how to deal with it?	oracle
Bash: Delete until a specific file	bash
NSColor with calibrated values works differently than regular color??	cocoa
Executing simple commands with Cocoa and Sdef.	cocoa
Little Bash Script: Catch Errors?	bash
Undeletable file due to backup script	bash
"""Creating """"pretty"""" Qt Custom Widgets"""	qt
Floating Point Comparison in Shell Script	bash
Cleaning up nested mod_rewrite statements	apache
Why is Clojure much faster than Scala on a recursive add function?	scala
magento simple product link to open grouped products page	magento
Programmatically Change System Network (Proxy) settings	osx
Spring JDBC connection pool and InputStream results	spring
Tips for using CVS or Subversion as a backup framework for office documents	svn
"""Per-filetype """"View whitespace"""" setting in Visual Studio"""	visual-studio
How to gain access to all  open windows on Desktop using Cocoa?	cocoa
Show product creation & last edit dates on Frontend in Magento	magento
Make Apache wait longer before delivering HTTP 408 request timeout	apache
Query to Delete Posts Older than X Days in WordPress	wordpress
SharePoint Lists, GetListItems, XML, and VBA - I just want to crossreference!	sharepoint
What is GHCi's default implementation of MonadError?	haskell
Changing a user created control based on content of input from JS tied textbox	ajax
Apache returns sitemap.xml not /sitemap	apache
QT question about a QList<QStingList>	qt
Firing a SharePoint Workflow by updating a list item through List Webservice	sharepoint
Response.redirect does not work with Ajax controls	ajax
Seqential & continuous invoice number in Hibernate / ColdFusion ORM?	hibernate
Running A Bash Script Over SSH	bash
Hibernate cannot remove child from database	hibernate
Using CMS to make webapps.	wordpress
QTMovie Notification	qt
Scala:  binary incompatibility between releases	scala
Dependency Inject by type using generics - how does it work?	spring
How should I think about Scala's Product classes?	scala
Unpacking varargin to individual variables	matlab
Drupal / Rules: flagging multiple terms on user save	drupal
Excel: parse text as formula	excel
Why does this Haskell code work successfully with infinite lists?	haskell
Using CoreData with an object?	osx
Understanding the different dispatchers in Akka 2	scala
Running X11 Server on MacOS X - and connecting from a remote machine	osx
Is there non-daemon FTP server application fot Mac OS? (like MAMP)	osx
integrating springMVC and extjs	spring
Where does Drupal store NODE data?	drupal
MetaStorm Ework and SharePoint 2007	sharepoint
Adding a custom member to a mapped type	linq
Qt +hiding window after startup	qt
SQL-WHERE TYPE Formulas in Excel	excel
Why does Spotlight sometimes not run my query?	cocoa
Hiding a SharePoint Custom Field Type in Edit and Create mode	sharepoint
Improve oracle query performance without indexing	oracle
Get all pixel coordinates of a vector inside a image	matlab
Creating a bundle - What's going wrong?	cocoa
static site apache and dynamic/member site django	apache
Java Project Configuration	spring
Detecting the number of ORACLE rows updated by a OCI OCIStmtExecute call	oracle
Using mod_rails to host multiple apps under SSL, same domain	apache
Howto get SharePoint version using object model	sharepoint
Excel: Formula to reference an entire pivot table?	excel
Can a Bash script tell what directory it's in?	bash
Oracle: What does `(+)` do in a WHERE clause?	oracle
svn + repostiory location	svn
Wordpress Add Links	wordpress
I need to order a list that is dependant on another list. how to change both lists?	matlab
Drupal node_save no longer returns $nid, so how do I get it?	drupal
hibernate lazy solution. Is it right??	hibernate
fatal error Varien_Autoload not found	magento
Wordpress: query all images in a posts media library	wordpress
Read excel sheet in c#.net	excel
BASH: Test whether string is valid as an integer?	bash
Sharepoint - Providing data outisde intranet	sharepoint
Is QuickSilver dead?	osx
MATLAB arbitrary code execution	matlab
"""""""Microsoft Visual C# IntelliSense has stopped working"""" in project referencing F#"""	visual-studio
Wordpress SEO Features	wordpress
Unsolvable Magento Cart problem	magento
Is it possible to aggregate information from portal list to My Site	sharepoint
Managing Browser History in Ajax	ajax
Drupal workflow action access integrated with taxonomy access control?	drupal
VisualStudio: How to save the obj folder somewhere else	visual-studio
Using Data.Heap in Haskell, or reading Haskell docs for a beginner	haskell
Is DB_LINQ + Non-MSSQL Database an acceptable substitute for LINQ to SQL with MSSQL?	linq
Scala compiler error due to constructor parameter (property) having same name in both base and derived class and used in derived method	scala
can not get scion_server to be created using runghc	haskell
Getting a List of Applications Capable of Opening a Type of File	osx
if exists statement in sql to linq	linq
mod_rewrite depends on what other modules?	apache
trouble connecting Excel to Analysis Services server..	excel
"""Cocoa Distributed Objects, Long Polling, lunchd and """"Not Responding"""" in Activity Monitor"""	cocoa
Looping over commands to print and execute in BASH	bash
I want my wp 2.8.6 blog to be seen as written in Spanish by Feedburner.	wordpress
how do i add a view to schema.xml in sharepoint	sharepoint
drupal search on the top taxnomy term	drupal
Drupal Photo Gallery Tutorial	drupal
Non-mathematical use cases for functional programming ?	scala
SVN Client integrated with OS X's Finder	osx
Best Way to ReUse Code When Using Visual Studio?	visual-studio
Composing actors	scala
Extended maxima transform in Matlab	matlab
What to do with “Inferred type is less polymorphic than expected”?	haskell
Setting error log filename in apache to include current date	apache
Apache FOP: Displaying UTF-8 Characters in PDF (without embed?)	apache
Restrict access using SSL certs	apache
jquery tab gives 404 sometimes when loading remote content	ajax
scala Slider throws casting exception	scala
spring custom namespaces with maven	spring
Format cell color based on value in another sheet and cell	excel
OSX - Retrieve user id of logged-in user from a system service	osx
Does Scala's pattern matching violate the Open/Closed Principle?	scala
How do I most elegantly express left join with aggregate SQL as LINQ query	linq
How to ensure AJAX encoding will work	ajax
Multiple views and source list in a Core Data app	cocoa
CruiseControl.net : Using SvnLabeller / SvnRevisionLabeller	svn
Dimension Reduction	matlab
Reading/writing QObjects	qt
Corrupted Qt Widgets on Windows Mobile	qt
Restrict LINQ Subquery when databound to a grid	linq
spike in my inverse fourier transform.	matlab
Hibernate NullPointerException In Loader Class	hibernate
Magento Installation Problem	magento
What's the best way to create a drop-down list in a Windows application using Visual Basic?	visual-studio
QtPython: removeChild/addChild QGroupBox	qt
Translate a Field's Label in a Drupal Content Type	drupal
Where is user specified data being stored on MacOS	osx
"""How can I make the """"find"""" Command on OS X default to the current directory?"""	bash
PHP wordpress style related posts	wordpress
Spring 3: task namespace: How to find out time of next execution?	spring
Deploy Qt+Boost application on a Mac and Windows.	qt
Oracle - ODBC connection using MS Access error (ORA-12154)	oracle
Visual Studio 2010 SP1 to 11 Beta - Unit Test Project Cannot be Loaded	visual-studio
What Confuses you about Magento Widgets?	magento
How do you solve this Haskell problem?	haskell
What are uses of polymorphic kinds?	haskell
hibernate many-to-one hql query, when inner join fetch property not associated	hibernate
LINQ across multiple databases	linq
Visual Stuido: Make view code default	visual-studio
SVN - Retrieving Useful Information	svn
Error: Attempted to access data(2,:); index out of bounds because size(data)=[1,7129].	matlab
Wordpress Roles > Allow Editors to Edit Themes?	wordpress
Making Excel 2002 use .NET v2.0.50727 runtime	excel
How would you recommend adding an image as a custom field in WordPress?	wordpress
how to click a text with underline for showing a web?	cocoa
"""VS2008 crashes with """"Fatal Execution Engine Error"""""""	visual-studio
matlab precision determint problem	matlab
Hibernate Computed Criteria Order	hibernate
Error: <target>.ColumnName and <source>.ColumnName have conflicting properties: DataType property mismatch.	excel
Trying to get rsync to copy files back to svn	osx
Matlab - divide matrix elements by column sums.	matlab
Drupal: Which MySQL do I need?	drupal
Custom comment form in CCK template	drupal
Scala Catalog of functional Design Pattern	scala
Need a little bit of help with text alignment in wordpress	wordpress
Sharepoint: Deploy Custom Lists and New Columns in lists	sharepoint
Is Haskell really a purely functional language?	haskell
Precompiled headers and compiling universal objects on OSX	osx
cd doesn't work when redirecting output?	bash
What's the equivalent of Oracle's to_char in AS400 DB2 SQL syntax?	oracle
LinqDataSource and DateTime Format	linq
Storing a passwords in NSString without being readable in memory	cocoa
Wordpress, WP_Query with custom taxonomy and custom post type	wordpress
Change owner on publish node in Drupal	drupal
Visual studio or resharper shortcut to close currently selected file in IDE	visual-studio
Manupulating Excel files from Windows Scripting Host	excel
Ajax Javascript show/hide works with JQuery 1.3.2 but not JQuery 1.4	ajax
image upload problem	hibernate
can you asyncronously notify a web browser?	ajax
Invoking Wine From Apache	apache
Customize the way CCK Node Reference fields are displayed in Drupal	drupal
Usage question: Spring AOP vs. AspectJ weaving	spring
Singleton Design	cocoa
problem with Double and Rational Number	haskell
Display Posts from a category in Wordpress?	wordpress
"""How does Apple make the info.plist display its """"Information Property List""""?"""	cocoa
changing search-dirs for $ sudo gcc	haskell
How to convert Excel sheet column names into numbers?	excel
Excel Overtime Calculation	excel
Darwin: how to kill parent process without killing child?	osx
Is there any good free tool for the mac, to draw UML and object diagrams?	osx
MATLAB: what's the most elegant way to delete known element in matrix?	matlab
How to categorize Google Docs published as posts to Wordpress	wordpress
Hibernate: Specifying columns in a one-to-many relationship	hibernate
Bash arrays: Need help with white space	bash
Resizing Mfc dialog with embeded QWinWidget	qt
Multiple servers checking and writing flag in database	spring
linq subquery returning null	linq
Is it necessary for Qt::paintEvent to be reentrant?	qt
Oracle: OALL8 is in an inconsistent state	oracle
What is the shorcut in visual studio to switch from code behind to Xaml Code ?	visual-studio
Visual Studio - Prevent stopping debugging from closing Internet Explorer	visual-studio
Pros and Cons of LINQ (Language-Integrated Query)	linq
Why does Haskell interpret my Num type as an Enum?	haskell
Excel reading in ASP.NET : Data not being read if column has different data formats	excel
A View Controller that can be instantiated both programatically and in IB?	cocoa
Linq to XML performance - Standalone test vs Very large web application	linq
finding apache build options	apache
PL-SQL: getting column data types out of query results	oracle
how to express {2n+3m+1|n,m∈N} in list comprehension form? ( N is the set of natraul number including 0)	haskell
Mac Plugins no longer support GetWindowFromPort?	osx
Read Excel File Data From HttpPostedFileBase object	excel
In Magento Layered Navigation, how do I get all items for active filters?	magento
including Qt headers in DLL	qt
Sharepoint ItemStyle.xsl for CQWP using images from a content type	sharepoint
What changes do I need to make Magento work with PHP 5.3?	magento
Highlight colors in an NSTableColumn on highlight	cocoa
Is there a Visual Studio shortcut for replacing the beginning and ending tag name in XAML/XML/HTML at once?	visual-studio
Do I understand Ajax correctly?	ajax
line of bash code from .configure file	bash
wordpress: actions, filters & hooks	wordpress
Can you print JavaScript variables from a Visual Studio 2008 Tracepoint?	visual-studio
Setting a default Apache RewriteRule entry	apache
Sharepoint Blog: enable/disable comments regarding field value of Posts	sharepoint
Magento backend problem	magento
Unable to open the Web site: http://.. Forbidden	visual-studio
Problem installing haskel-platform	haskell
numericupdown control	visual-studio
Why is the + operator for List deprecated in Scala?	scala
Best setup for code promotion and feature branching in Subversion?	svn
Short way of making many beans depend-on one bean	spring
Tools for matching name/address data	oracle
a sufficant way to show logs in a graphical interface using whiptail bash	bash
Change background of Terminal.app from the commandline	osx
Hibernate mappings: Splitting up the file	hibernate
Creating object named after the value of an NSString - is it possible?	cocoa
Hibernate - query caching/second level cache does not work by value object containing subitems	hibernate
Using an IOService port reference to turn off a device...	osx
Moving advanced search - Magento	magento
Have you integrated Mantis and Subversion?	svn
How do you handle arbitrary namespaces when querying over Linq to XML?	linq
[Matlab] Saved EPS image different than plotted chart	matlab
newly installed apache serving html content as text	apache
"""Subversion ignoring """"--password"""" and """"--username"""" options"""	svn
"""Why does my web part throw an error about """"NT Authority/Anonymous User""""?"""	sharepoint
Bash: Copy a folder full of files and folders to an external hdd, but only if there is enough space to complete the copy.	bash
Are there tools that would be suitable for maintaining a changelog for a Cabal Haskell package?	haskell
Merge contents of 2 Excel cells keeping character format intact (using VBA)	excel
What's XLSHTML?	excel
QMutex stuck in locked state	qt
Ajax autocomplete (or autosuggest) with TAB completion similar to shell command line completion?	ajax
Tool to automatically reformat whole C# source tree in VS2008?	visual-studio
What OR/M tool that supports Linq/Iqueryable would you recommend?	linq
Google Adwords conversion on form submission in Drupal	drupal
How do you code up a pattern matching block in scala?	scala
Best Way to Ajax-Control Table Rows	ajax
Is it possible to bind the null placeholder in Cocoa?	cocoa
Implementing Tiny MCE As Local HTML Editor	apache
hibernate Open Session in View	hibernate
Defining a seemingly simple Foldable instance	haskell
VS2008 debugging with firefox as default browser - how to make the debugger stop/close on exit?	visual-studio
"""Creating a """"Breaking News"""" div with ajax if file exists?"""	ajax
linq to xml - get rid of blank xmlns	linq
Spring Security: Redirect to invalid-session-url instead of logout-success-url on successful logout	spring
Hibernate, instrumentation and delete cascade order	hibernate
Print certain tabs	excel
scala: 'def foo = {1}' vs 'def foo {1}'	scala
Is there an encyclopedia/list of common type classes in Haskell?	haskell
Do you continue development in a branch or in the trunk?	svn
Split ByteString on a ByteString (instead of a Word8 or Char)	haskell
How to I authenticate with a ISA proxy from my application seemlessly?	qt
A general linux rights question: Apache and WordPress	apache
C framework like Qt ?	qt
Improve my Haskell implementation of Filter	haskell
Extracting generic Linq queries	linq
How to set Wordpress and index.php to WP site	wordpress
Using Node Data after Node is Created	drupal
Stop a custom submit button from firing the form validation on a CCK form	drupal
Running subversion under apache	svn
definition of filter function with foldr, in haskell. i want to see if i understand how it's working.	haskell
How to change tinyMCE editor's button's default tag output in wordpress?	wordpress
How can you dynamically load Javascript functions using Ajax?	ajax
How to inject spring beans into a jsp 2.0 SimpleTag ?	spring
Subversion Tagging and Security	svn
EBNF to Scala parser combinator	scala
Oracle Analytics inside Cursor	oracle
How can I pass a complete argument list in bash while keeping mulitword arguments together?	bash
Bash One Liner: copy template_*.txt to foo_*.txt?	bash
Hibernate: unmapped class association exception	hibernate
QByteArray to integer	qt
password recovery for drupal	drupal
Moving  MS Excel data to a website via a web service.	excel
PCI compliance issues for Magento running on Bluehost	magento
Why does Scala have very little Enthusiasm about it?	scala
Oracle Pl/SQL: Loop through XMLTYPE  nodes	oracle
linq question: querying nested collections	linq
Could/should an implicit conversion from T to Option[T] be added/created in Scala?	scala
"""How to get and display post's """"position"""" in the query?"""	wordpress
Example of Spring missuse	spring
substituting an Excel worksheet for an Access database	excel
Is there an efficiency penalty when using Scala inner functions within non-tail recursive functions?	scala
Use LINQ to concatenate multiple rows into single row (CSV property)	linq
Sharepoint Lists.asmx: The request failed with an empty response.	sharepoint
Gridlines in excel through interop	excel
LINQ-to-SQL and mass-changes submit very slow	linq
Oracle Forms/Applications in Internet Explorer 8 using JInitator	oracle
SVN Weirdness: Is It Possible It's Not My Fault	svn
Hibernate Criteria - Exclude records with same id but different attribute values	hibernate
"""Implementing """"scrubby sliders"""" in Cocoa?"""	cocoa
Multi-threaded BASH programming - generalized method?	bash
Using Alias in Apache ONLY if local directory not present?	apache
What access does Apache 2.0 need in Windows Server 2003 in order to start as a service?	apache
WordPress url error on IIS 7	wordpress
how to send an object from one js file to another js file ?	ajax
adding oracle's timestamp to query results	oracle
Question about [[]], [] and $#	bash
Unable to enable jquery UI module in drupal??	drupal
Best way to set HTML head title in a Spring+Tiles2 application?	spring
Ajax: Load XML from different domain?	ajax
Oracle empty strings	oracle
New folders are not uploaded in SVN	svn
How to serve files in Drupal without using links?	drupal
Magento API: Assigning preexisting simple products to configurable products	magento
Haskell numeric type heirarch in SICP exercises	haskell
wp_list_categories does not show current category	wordpress
Fill array with consecutive integers	excel
How do I configure visual studio to use the code view as the default view for Webservices?	visual-studio
tortoise svn in system tray possible?	svn
Bash egrep numbers not working in case	bash
OS X Data Storage in PLIST Example or Tutorial?	osx
linqtosql, timespan, aggregates ... can it be done?	linq
In QT, for a context menu item, how to hide the space of the icon	qt
shared library locations for matlab mex files:	matlab
SVN Manager App for Mac (better than XCode)	svn
Looking for recommendations on a good bash tutorial	bash
Magento - get list of items from orders for specific date range	magento
Understanding Haskell's filter	haskell
With wordpress, is there a statement like current_user_can except show something if a user does not have specific access?	wordpress
Not able to check if user is logged in magento system in footer.phtml file on some pages	magento
Hibernate SQL Audit Logging	hibernate
yslow still not giving me an A for expires header in apache httpd even though I added them	apache
Is there ANY way to suppress the browser's login prompt on 401 response when using XmlHttpRequest	ajax
Java Swing or Java Qt?	qt
Preserving data integrity in Drupal:	drupal
Help with Magento Custom Module. Redirect to another module and return to checkout	magento
QT: reject() closing whole app? Why?	qt
Visual basic auto imports namespaces	visual-studio
VB.Net Linq - How to append a where clause?	linq
redirecting standard output to the calling process	bash
How to cancel ajax request that has run (on server side)	ajax
How do I keep Resharper Files out of SVN?	visual-studio
"""MFC """"Warning: skipping non-radio button in group."""""""	visual-studio
annotation() and text() in Matlab	matlab
How can grep interpret literally a string that contains an asterisk and is fed to grep through a variable?	bash
WordPress Child Theme	wordpress
How to wrapp an Oracle stored procedure in a function that gets executed by a standard SELECT query?	oracle
JPA Multiple Persisrtence Unit [bug]	spring
Apache Tomcat 6 Problem Not Found(404)	apache
Excel form hides behind other windows after I browse for file but I want it to stay on top.	excel
'XMLHTTPRequest is Undefined' IE6	ajax
ListTemplateOwner	sharepoint
What is the best way of retrieving a specific post in Wordpress?	wordpress
SVN Error: Expected fs format between '1' and '3'; found format '4'	svn
PL/SQL: Problem in WHERE clause ( don't know how I can address results from DECODE() function in WHERE clause).	oracle
wordpress multiple loops problem	wordpress
Using VS 2005 to design abstract forms	visual-studio
Wordpress: Two different Permalinks for same Blog	wordpress
magento stock management with external inventory management program	magento
Magento: Getting Product Url's for Products within a Grouped Product	magento
Updating live server from VCS	bash
GHC refuses to export qualified modules	haskell
Can one access TestContext in an AssemblyCleanup method?	visual-studio
Modify Latest Blog Posts in WordPress	wordpress
Is there a difference between delegate/selector and target/action?	cocoa
Testing QuickCheck properties against multiple types?	haskell
Scala/Lift question rss feed fetch	scala
Haskell: What is the difference between $ (dollar) and $! (dollar exclamation point)	haskell
"""How do I do """"svn st"""" in AnkhSVN for Visual Studio? -no text-"""	svn
Oracle in-line method to produce CSV for relation	oracle
A command line that yields the complete URL of a file inside the svn repository?	svn
What should a longtime Windows user know when starting to use Linux?	bash
Cocoa NSView changing autosizing properties	cocoa
How do I go from 1.4795e+004 to 14795.00 ??	matlab
add a server alias to the domain's VHOST?	apache
Default row ordering for select query in oracle	oracle
Used MacPorts to install WordPress. Where is it now?	wordpress
Multiple loop working, function inside isn't	wordpress
Changing the Admin Theme in Drupal 6 Directly in Database	drupal
Simplest build of QMYSQL3	qt
w3schools AJAX example	ajax
creating rss.xml file for wordpress posts...	wordpress
Scala: Where do I find an OS project written in scala?	scala
bug in linq Contains statement - is there a fix or workaround?	linq
"""Wordpress Install: """"ERROR: you must provide an e-mail address."""""""	wordpress
MOSS Web Solution Package breaks when moved	sharepoint
Is bash scripting still the way to go?	bash
Plotting data with meshgrid	matlab
Simple symlink in web root returns access denied	apache
Expose VSTO functionality to VBA w/o local admin	excel
Can AJAX calling a external webservices functions	ajax
Using fields from a 'lookup-ed' sharepoint list	sharepoint
Using a Mac for crossplatform development?	osx
Function or Procedure for an IN clause	oracle
Problem using @SecondaryTable in Hiberante	hibernate
Does qt 4.5 have any skins?	qt
scala: annotating accessor methods	scala
.TXT FILES IN MATLAB	matlab
Saving matlab sparse matrix to text file	matlab
Magento: Filter Configurable Product by their options	magento
Please explain what an outlook add-in is	visual-studio
Any disadvantages of accessing Subversion repositories through file:/// for a solo developer?	svn
svn ignore without deleting files?	svn
JPA EntityManager, how does it work??	hibernate
[Haskell] Set of an Unordered Data Type with a given ordering	haskell
Multi-lingual Drupal Site	drupal
Can I compile legacy MFC applications with Visual Studio 2008 ?	visual-studio
Providing data as needed for QTMovie	cocoa
Plot data reconstruction reading pixel colors from image files	haskell
How can I load an image saved in database to Visual Studio ReportViewer 2008?	visual-studio
Haskell parsing tools - yacc:lex :: happy:?	haskell
"""(newbie) type signature """"Maybe a"""" doesn't like """"Just [Event]"""""""	haskell
Can I run Excel from a .cmd script with all macros enabled?	excel
Eclipse RCP on OSX - How to stop logging to syslog?	osx
Reading a list from a java .properties using Spring properties place holder	spring
drupal  how to refresh the page when the content is created in the popups	drupal
Drupal Theming - Background images without dimensional constraints	drupal
retrieve only sub-pages (wordpress)	wordpress
