text	label
What are the design patterns which used in Spring framework?	spring
Oracle Analytic Question	oracle
Writing two dimensional array to file and reading two dimensional array from file using Visual C++	visual-studio
Can anyone tell me why Apache will not work, for my Django?	apache
Strange Exception thrown using Dynamic Linq Entity Framework Query	linq
How does one manage multiple release branches in subversion?	svn
Security of scala runtime	scala
Whay was writtem matlab in C instead of Fortran?	matlab
Deleting A Row From An Outline View.	cocoa
Case-insensitive search using Hibernate	hibernate
Open string in app per drag'n'drop on icon	cocoa
newbie question: what role does the indentation play here? and Why one indent doesn't work?	haskell
Can Spring Webflow 2.0's entity manager commit from subflow states?	spring
Does anyone have experience with National Instruments CVI and source control?	svn
How can I get a list of products related to an invoice in magento?	magento
"""Excel VBA: force refresh of """"last"""" cell of the worksheet"""	excel
Subversion cross-file keyword substitution	svn
Temporary text attributes causing massive slowdown	cocoa
Magento: Display # of pages in category list page	magento
QtScript: crash on 64-bit windows.	qt
Default News Feed on Visual Studio Start Page (C# Profile)	visual-studio
Primitive recursion	haskell
Paginating a long list of checkboxes in Magento	magento
Setting up a one-time installer using Apple's PackageMaker	osx
does ssl also encypt ajax posts?	ajax
Hibernate, GWT and Gilead: sessions, transactions and caches	hibernate
Is Scala the next big thing?	scala
Haskell: How to write interactive interpreter on top of a State monad?	haskell
Hibernate: ORDER BY using Criteria API	hibernate
What's the least painful way to transfer local Subversion changes to another machine?	svn
using RewriteCond, can i change how fast content is served to users in different parts of the world?	apache
Finding out what user Apache is running as?	apache
Oracle: Program not forking correctly in SELECT CASE statement on a date	oracle
When does svn BASE become equal to the HEAD	svn
Apache capacity planning tool?	apache
endian-ness of new macs - are all pc platforms the same now?	osx
0x800a03ec when calling Select on an Excel range (IRange). Range was returned from the worksheet's usedrange.	excel
How Can I Remove .DS_Store Files From A Git Repository?	osx
Drupal 7 programming advancements, differences from Drupal 6 upgrade or wait	drupal
Hidding source control files within Visual Studio's solution tree	visual-studio
Can Apache BalancerMember be configured to use unix domain sockets?	apache
Are SharePoint site templates really less performant than site definitions?	sharepoint
"""Adding Thumbnail Image on """"Related Products"""" on the Backend of Magento"""	magento
Hibernate + Spring + persist one-to-one relation + empty foreign key	hibernate
Reloving AliasRecord with relative path on a new volume	osx
"""Magento - Hide price and """"Add to Wishlist"""" link in Category product list page"""	magento
Correct Structure to check for Errors using NSError	cocoa
SharePoint Event when Permissions of ListItems have been changed ?	sharepoint
Drupal page optimization question... which is better?	drupal
Lost RPC connection to remote Agent error with Oracle connected to Informix	oracle
Why does Visual Studio debugging mode does not work properly (performing F5 when F11 was pressed)	visual-studio
Add QRadioButtons on runtime.	qt
Python interface to the Apache scoreboard (for server statistics)?	apache
Any solution to the Today Calculated Column problem is SharePoint?	sharepoint
SpringJUnit4ClassRunner initialize beans for each test?	spring
How do I determine which service pack Visual Studio is running?	visual-studio
How to force Hibernate 3.3 or 3.5 to use CGLib instead of Javassist?	hibernate
Group By Multiple Columns - LINQ	linq
ServerContext.Current is null	sharepoint
Limiting the total number of certain types of nodes a user may create in Drupal by role?	drupal
using find with exec	bash
What could cause Visual Studio / C# error MSB3105: Duplicate resources	visual-studio
Is it possible to use Qt threading without inheriting any Qt object?	qt
qt/c++ casting question	qt
Magento e-Commerce cannot generate reports	magento
.NET coupled with MATLAB or R?	matlab
IDictionary is Linq friendly? C# 3.0	linq
App Servers vs. Spring	spring
Functional equivalent of if (p(f(a), f(b)) a else b	scala
Ignore a path entry with bash tab-completion	bash
Drupal : How to add javascript function on click event of a cck check box ?	drupal
Object reference not set to an instance of object error	linq
QComboBox with single value: Select this value	qt
Flattening Linq Group query	linq
what is the purpose of form_state , delta variables in drupal	drupal
URL regex search and replace on MySQL (in WordPress)	wordpress
magento chnge feture product change	magento
http://stackoverflow.com/questions/643853/customaction-not-appearing-in-listview-web-part-for-splist-that-does-not-inherit	sharepoint
matlab to draw ellipse and ellipsoid	matlab
Visual Studio Tips on getting headers that are used in a given project?	visual-studio
Runtime error 1004: Application-defined or object-defined error	excel
Hibernate JPA Sequence (non-Id)	hibernate
Mac Terminal.app annoying bug - How to fix it?	osx
If all my sql server database access is done thru stored procedures.....	linq
QProcess::setStandardOutputFile only creates 0kb File	qt
How to get All Credit card Details entered by Customer till now in Magento?	magento
Haskell - mapping the odd placed values and the even placed values differently	haskell
java.lang.UnsatisfiedLinkError: Native Library {____.dll} already loaded in another classloader	matlab
How to track down CPU intensive requests	apache
Regular expression with RedirectMatch does anything	apache
Matlab command to access the last line of each file?	matlab
auto-detecting components using spring annotations	spring
Encoding of the AuthzSVNAccessFile	apache
Need to add selector to child UL in WordPress menu	wordpress
XLL plugin's DDEConnect fails when connecting to Excel?	excel
local variable inside  the loop issue	bash
Oracle: What exactly do quotation marks around the table name do?	oracle
Using Linq SubmitChanges without TimeStamp and StoredProcedures the same time	linq
Haskell: Writing text files and parsing them back to original format	haskell
Magento product's category	magento
Visual Studio Unit Test - The member specified could not be found.	visual-studio
Fetch iTunes album artwork without iTunes running	cocoa
oracle subselect with dynamic table and column	oracle
Duplicating views	cocoa
Why aren't jQuery and cycle working in Wordpress?	wordpress
Qt4: QTableView mouse button events not caught	qt
When using a LINQ Where clause on a Dictionary, how can I return a dictionary of the same type?	linq
Tortoise SVN Move command fails	svn
LINQ to entities - Building where clauses to test within a many to many relationship.	linq
Drupal Token Examples of Usage	drupal
What would make development with SharePoint easier?	sharepoint
grep-ing multiple files	bash
How to solve the problem with the use of deprecated function ereg() of PHP 5.3.0 in Drupal  6.13	drupal
Apache using Python 2.4, Python 2.5 scripts failing	apache
Digester: Extracting node name	apache
Oracle TIMESTAMP WITH TIMEZONE named zone vs offset	oracle
Multiple web application deployment targets in Visual Studio 2008?	visual-studio
LINQ: what is the type of a result?	linq
Give me awesome Visual Studio keyboard short cuts!	visual-studio
Visual Studio Solutions / Multiple project : How to effectively propagate project properties amongst several projects	visual-studio
BPEL for data synchronization	oracle
Updating your blog from a localhost version	wordpress
How to avoid storing passwords in the clear for tomcat's server.xml Resource definition of a DataSource?	oracle
Passing BASH arguments	bash
Hide categories that have no products magento	magento
Can you configure mod_proxy as a reverse proxy cache?	apache
How come sqlplus not connecting?	oracle
Compiling a shared library with QT on Ubuntu 9.10	qt
What is the conceptual difference between a Product and a Quote Item	magento
Application crashing when talking to oracle unless executable path contains spaces	oracle
Which one to use for payments on Drupal website, LM_Paypal or Ubercart ?	drupal
wxhaskell asynchronous updates	haskell
Excel 2003 VBA error 1004 after XML data import	excel
WordPress query posts into two Divs	wordpress
"""Direct """"puts"""" in Rails, to Apache log"""	apache
How is Magento when it comes to adding custom functionality?	magento
Excel 2002 Add-In not loading when the application opens	excel
Excel: Set background colour of cell to rgb value of data in cell.	excel
Is there option to have powerfull URL and Aliases in Drupal, not the poor one that I've found?	drupal
Which naming conventions do you use for SVN Branches and Tags?	svn
Sharepoint: how can i find all the pages that host a particular web part?	sharepoint
Hibernate Second level Cache <<net.sf.ehcache.hibernate.EhCacheProvider>>	hibernate
Is it possible to change the step size of the built-in haskell range function or literal?	haskell
Apply dynamic properties to a bean at runtime	spring
Naming Tags (Wordpress)	wordpress
SVN update command to target a single externals subfolder ?	svn
Automatic migratiion between different Persistent backends	haskell
HIbernate - HBM.xml Automatic generation from DB Schema	hibernate
Easiest way to extract the urls from an html page using sed or awk only.	bash
Getting the speaker audio signal and then streaming it out	osx
what is encoding in Ajax?	ajax
Spring parent and child resources	spring
Qt LGPL license exception?	qt
Mac Dev - How to refresh view for 2d game?	osx
"""using haskell for """"business applications"""""""	haskell
"""Provide user with """"change permissions"""" link on content type?"""	drupal
Why does QWebFrame::evalutateJavaScript do nothing in this case?	qt
creating patches between revisions per file	svn
How to efficiently find correlation and discard points outside 3-sigma range in MATLAB?	matlab
"""What does this Python code do:  shell=(sys.platform!=""""win32""""))"""	osx
Caching a resultset	spring
QT, making UI that shrinks and expands	qt
"""Why is there """"data"""" and """"newtype"""" in Haskell?"""	haskell
How to access a field's value via reflection (Scala 2.8)	scala
Haskell speculative parallel execution	haskell
Are LINQ expression trees Turing complete?	linq
"""Continuation monad """"interface"""""""	haskell
Magento; dispatch multi store	magento
iPhone subview design (UIView vs UIViewController)	cocoa
how do i hide /magento/ in my site's url?	magento
Can apache's ProxyRemote be used to proxy HTTPS requests to mongrel for processing?	apache
Why does Visual Studio 2008 forget where to dock my add-in's window pane?	visual-studio
Opening terminal windows with bash	bash
Drupal Array of Inputs	drupal
sequenctial autogenerated Id with help of linq	linq
Getting Spring Application context from a non bean object without using Singleton	spring
Apace mod_rewrite redirect to internal server	apache
Linq: How to Assign to Related  Entities ?	linq
Fudge Factor in Matlab	matlab
Displaying Japanese fonts in source code using Visual Studio	visual-studio
Microsoft Excel mangles Diacritics in .csv files?	excel
Dynamically hiding columns in a NSTableView	cocoa
adding single.php page to wordpress or if condition for main page or post detail page...	wordpress
Why are people continuing to use xml mapping files instead of annotations?	hibernate
Automatically compile any Java class when the file is dropped in a directory	osx
IFilter dll works on Windows Desktop Search, but not on SharePoint 2007	sharepoint
Cocoa binding to a particular item in an array controller	cocoa
Drupal: Sharing content across Multisite	drupal
How is pattern matching in Scala implemented at bytecode level?	scala
MATLAB Heart Curve	matlab
read data into matlab from textfile	matlab
serve with apache all paths under a domain through one script.	apache
Haskell Input & Passing Values to Functions	haskell
Getting Kind mis-match error when trying to use existential quantification	haskell
Shading an area boundered by a curve	matlab
Why does hibernate-entitymanager-3.3.2.GA depend on hibernate-3.2.6.ga?	hibernate
scala override methods in child object of class	scala
Can I use Magento without the sales features? Or am I better off with a scratch build?	magento
AJAX Call to PHP script gives me 500 Internal Server Error??	ajax
Copy Protection (mac apps): most cost effective solution??	cocoa
spring vs ejb. can spring replace ejb?	spring
What is the _root_ package in Scala?	scala
Spring-AOP	spring
have you tried the Spring Workflow alreay ?	spring
Are Rank2Types/RankNTypes practical without polytype variables?	haskell
Oracle - How to have an out ref cursor parameter in a stored procedure?	oracle
basics of using cut awk grep and sed...	bash
JQuery ajax error function is executed even if query is successfull	ajax
What's the best .NET library for parsing and generating Excel spreadsheets?	excel
Setting a charset symbol in dylib	osx
Looking for book on Bash scriping	bash
Case senstive validation in Excel from Named List	excel
Haskell sorting of an unorderable list using a proxy order	haskell
[self arguments] in NSScriptCommand	cocoa
When to use the equals sign in a Scala method declaration?	scala
Integrating Visual Studio Test Project with Cruise Control	visual-studio
What's a good library to manipulate Apache2 config files?	apache
Warning: Ignoring excess mask dialog entries in:	matlab
Scala's Implementation of haskell last method	scala
Sharepoint 2007 NTLM issue with ASP.NET Web App hosted on Sharepoint server	sharepoint
Integrating Magento with SAP ECC 6.0 Backend	magento
Doing Forms With Just Windows SharePoint Services 3.0?	sharepoint
Is the Zen theme for Drupal enterprise ready?	drupal
Spring beans, Lifecycle in a XmlWebApplicationContext (web context)	spring
Pattern matching with multiline XML case	scala
Designing WordPress Themes using Dreamweaver	wordpress
LINQ JOIN in String Array	linq
Which version control tool is best sutiable to handle reflective or cyclic mergeing? SVN, Git?	svn
SVN branching and merging in a rapidly changing feature environment with a high-turnover	svn
How to tell if the user's using 24 hour time using Cocoa	cocoa
Hibernate: Identifier	hibernate
Using LINQ with stored procedure that returns multiple instances of the same entity per row	linq
In MATLAB, what ASCII characters are allowed to be in a function name?	matlab
hibernate: Is this mapping allowed?	hibernate
CSS not rendering on MAMP	wordpress
Using predicates on an array controller to filter related objects	cocoa
bit.ly links in wordpress twitter status updates leads to 404	wordpress
Another shell open when at server?	bash
bash: redirect and append both stdout and stderr	bash
Discrete Wavelet Transformation	matlab
Tricky brace expansion in shell	bash
Name clashes between field labels of different datatypes in Haskell	haskell
OS X Keychain's Password Assistant feature via Terminal	osx
How do I find a complete list of extensions installed in VS2008?	visual-studio
Guard is skipped when it should not be.	haskell
custom filter is not woring - Magento	magento
cascade on many-to-one association in hibernate	hibernate
Restrictions in trait mixing	scala
Sorting a Drupal field View by updated time.	drupal
How to determine if currency symbol is to the left or right of a number on MacOS	cocoa
Filterable SPFIeldUrl in default view.	sharepoint
Casting DateTime to OracleTimeStampTZ	oracle
using ajax update panel for update progress	ajax
configure apache 6 with mysql	apache
Detecting when an NSView is dealloc'ed	cocoa
Cocoa NSArray/NSSet: -makeObjectsPerformSelector: vs. fast enumeration	osx
ReportViewer displaying black background in Print Layout mode	visual-studio
"""Oracle connection problem on Mac OSX: """"Status : Failure -Test failed: Io exception: The Network Adapter could not establish the connection"""""""	oracle
Haskell FFI: ForeignPtr seems not to get freed	haskell
How can I filter a product's availability using isSaleable attribute?	magento
Delete all files but keep all directories in a bash script?	bash
Encoding Keyboard Command Onto Bash Script	bash
Has someone recent and trusted news about Linq to XSD?	linq
Add (external) relationship (tagging) to existing Hibernate entities	hibernate
jquery form plugin & programmatic submit	ajax
Concurrent sum	excel
Find file launching a process	bash
Is there a way to force traffic comin from www.abc.com to go to abc.com via htaccess or dns?	apache
Callback for Button in QtCreator?	qt
Do I have to delete it? [Qt]	qt
In bash, how does one clear the current input?	bash
Problem (bug?) loading hexadecimal data into MATLAB	matlab
Select count(*) from multiple tables	oracle
error handling with spring + servlet spec	spring
How to set up Drupal default front page (view) to open in other language than default	drupal
collate 500 excel sheets into database	excel
Hibernate: Connect to MySQL without Username or Password	hibernate
LINQ - which layer should LINQ typically fall into, DAL ?	linq
Referencing an Excel address within a cell, but also additional text	excel
Using j2ep on an apache-tomcat cluster - design help	apache
Matlab get file size	matlab
Equivalent of GetCursorPos() in Mac's Carbon	osx
Why toInteger :: Int -> Integer is lazy?	haskell
Remove newline character from first line of NSString	cocoa
Integrating Spring Webflow 2 and Apache Tiles	spring
Ever need to parse the svn log for files committed by a particular user since a certain date?	svn
Adding a Custom Widget to Qt Designer	qt
Access and modify attributes/objects which are not part of the form backing bean	spring
Return value of nth or last match	excel
Access denied  Tortoise SVN 64 bits	svn
QT: custom widget in QScrollArea	qt
Performance effect of enabling apache response time log directive	apache
Progressive Enhancement	ajax
Hibernate MappingException Unknown entity: $Proxy2	hibernate
Excel vba: error hiding calculated field in Pivot tale	excel
Why always return null when call the method IQueryable.FirstOrDefault()?	linq
qt cannot open input file 'c:\Qt\qt\lib\qtmaind.lib'	qt
Negate Unsigned Number in Bash	bash
AJAX presentation ideas!!	ajax
Excel document recovery	excel
hibernate.hbm2ddl.auto how does Hibernate decide when to create or update the ddl?	hibernate
what do the terms formBackingObject and ModelAttribute mean in Spring MVC?	spring
Keep formatting on an excel cell	excel
Video streaming woes	osx
Qt does not create output files in debug/release folders in Linux	qt
Building the Multimedia Module of Qt Mobilty with QML Extensions	qt
Hibernate/Spring: Persisting collections	spring
Which LINQ syntax do you prefer? Fluent or Query Expression	linq
Capture console output for debugging in VS?	visual-studio
Excel formula to determine cell ID when a series of numbers turns negative	excel
drupal cck image_field and imagecache	drupal
Magento: Multiple calls to same block template with cache on	magento
Errors in Windows Forms controls in designer view	visual-studio
Remove white backgrounds from images	cocoa
how do i get a checkbox item from a QTableView and QStandardItemModel alone?	qt
Good Syntax Highlighter For Self-Hosted WordPress Blog	wordpress
What's the difference between Tomcat JNDI based and Spring/Hibernate DS based connection pooling	spring
SharePoint Visual Studio document upload Web Test fails with Connot close stream until all bytes are written	sharepoint
What's the difference between [A,B] and [A;B] in MatLab?	matlab
Conditional Multiple Fields Searching and Filtering in LINQ	linq
Batch Renaming with Bash	bash
First non-empty cell in a spreadsheet row	excel
How the Scala script that reads 5G log file from network drive should be modified in order to read last x lines (like 'tail' in Unix)?	scala
svn merge with revision not doing what I expect	svn
Why does my Out of the Box SharePoint Navigation look like it is leaking memory	sharepoint
Bash: Subprocess access variables	bash
Linq2Entities / Linq2Sql - Comprehensive search...	linq
"""scala """"error: io error while decoding"""" """"with utf-8"""""""	scala
Magento: Can you set it so all Websites share the same order increment id sequence?	magento
AJAX progress bar dispaying loading progress percentage for page load	ajax
Storage of auditable fields per entity	hibernate
Clean up before closing the QCoreApplication.	qt
Sharepoint 2007 maintenance and staging	sharepoint
Custom EntityNotFoundDelegate	hibernate
Can I make QCompleter complete inline and show a popup.	qt
Download attachments in one file	drupal
In Drupal 6, is there a way to take a custom field from the latest post to a taxonomy term, and display it in a view?	drupal
Oracle SQL Developer not responsive when trying to view tables (or suggest an Oracle Mac client)	oracle
Java spring database application won't quit reference to org.enhydra.jdbc.pool.PoolKeeper is still active why?	spring
Purposefully Slow Function	matlab
Crucial Drupal Modules for Dynamic Site Development	drupal
unit of work in a java 'main' application	hibernate
Using Apache Rewrite to go from HTTP to HTTPS and vice-versa, but I get a 302 response and my app errors out.	apache
NSDateFormatter won't parse dates using locale settings?	cocoa
Appropriate VS Project for Multiple .Net Sites	visual-studio
Making a drupal database call using ajax	drupal
Wordpress Seo features	wordpress
How to use AJAX in DRUPAL	drupal
Matlab book on geometry and image processing	matlab
What do I need to offset the performance setback induced by use of the Spring framework?	spring
Drupal: add contact form as field to user profile	drupal
CAML query to locate specific SPFolder nested in document library tree	sharepoint
parsec-3.1.0 with custom token datatype	haskell
Cannot access new product attributes in grid display	magento
Linking Simple product to their page listed under Grouped product in Magento	magento
Right click on sheet-tabs disabled in Excel	excel
Excel function to determine the last Friday in a month	excel
Oracle Associative Array TYPE is not able to use in USING statement (If  TYPE is declared within Package)	oracle
Tool for translation of Oracle PL/SQL into Postgresql PL/pgSQL	oracle
multiple security:custom-authentication-provider	spring
In Scala 2.8 collections, why was the Traversable type added above Iterable?	scala
matlab 2009 creating symbol	matlab
good stand-alone svn client	svn
Excel OpenText method	excel
What does the Alias attribute of FieldRef do?	sharepoint
Bash Case menu - dynamic choices	bash
An RMIPRoxyFactoryBean factory in Spring?	spring
Override SPList.WriteSecurity behaviour?	sharepoint
Haskell type error: Could not deduce (Show a) arising from a use of `show' from the context (Num a)	haskell
A simple way to generate tones / sine waves on mac? (ruby would be nice)	osx
Loop through PageField in OLAP Cube [PivotTable]	excel
Check each pixel for a specific colour (within a certain threshold)	matlab
Setting expires header for a specific URI?	apache
Passing a native pointer to performSelectorOnMainThread's withObject argument?	cocoa
AJAX readystate breaking, AJAX not processing data fast enough?	ajax
Is QHash::contains method case-sensitive or case-incensitive?	qt
how will you take only stored procedure backup in oralce 10g?	oracle
Troubles after installing Two stores with same php docroot	magento
One Sharepoint Feature or many inter dependant ones	sharepoint
Primitive recursion	haskell
Which one of the java spring books to start?	spring
[MAGENTO] How to use an external lib? (PclZip)	magento
USB (PNY 4GB) suddenly appears empty - mounts, but name is strange, files not there	osx
AJAX/NPH Scripts under Apache 2.2.9 - without the nph-name preface?	apache
Apache reverse proxy set up secure certificate	apache
AJAX C# AutoCompleteExtender contextKey	ajax
Is there an easier way to add menu items to a wordpress navigation menu?	wordpress
Question about what I should have before Connect	qt
Trying to get the information of session WebFlow Spring	spring
Example of using AuthType Digest to authenticate a user once across sub-domains?	apache
Global object for Javascript to interact with Safari plug-in	cocoa
is there any scala network library with actor model	scala
Wordpress: add a custom field option that's available to all posts	wordpress
Spring Entity to use Service, possible design flaw, but still....	spring
Getting Excel 2003 to interpret a pasted number with leading zeros as text (works fine in 2007)	excel
JavaScript developer looking for insperation from frameworks such as cocoa	cocoa
How would you set up an Subversion repository for in house software projects	svn
In excel automation, how to gracefully handle invalid file format error upon file opening?	excel
Setting nested object to null when combobox has empty value	spring
recursively add file extension to all files	bash
The Matlab equivalent of pyton None	matlab
How can I serialize (and later deserialize) a generic type in Scala?	scala
Is OpenAtrium really slow?	drupal
"""Please confirm or correct my """"English interpretation"""" of this Haskell code snippet"""	haskell
Creating Haskell instance declarations	haskell
Copy Excel worksheets, macros, and graphs from one workbook to another, moving links to the new workbook	excel
Flex, Cairngorm and XML-RPC	magento
Relational databases and OO languages	linq
Spring 3 DI using generic DAO interface	spring
Dynamic injection of bean properties based on a locale variant in Spring	spring
is it possible to print all reudctions in Haskell - using WinHugs?	haskell
CocCoa Application	cocoa
Does Visual Studio have anything like Borland's CodeGuard?	visual-studio
Run db query (sql server 2005) with ajax. Is it possible?	ajax
Using MonadPlus in FRP.Reactive.FieldTrip	haskell
What stratagies are best for storing art assets in SVN?	svn
