text	label
Hibernate one-to-one entity association with shared PK between 3 classes	hibernate
Why is Magento trying to call in the Mage namespace rather than my custom namespace?	magento
Keyboard and mouse event transparent widget	qt
Magento Debugging Environment	magento
i install Magik_Featuredproducts component in magento after install i can't access my adminpanel and front view ?	magento
batch create users?	drupal
Qt vs WPF/.NET	qt
bash: $[<arithmetic-expression>] vs. $((<arithmetic-expression>))	bash
Haskell FFI: Calling FunPtrs	haskell
SharePoint OOTB Workflow Problem	sharepoint
Linq to SQL: order by value in related table	linq
trying to install hs-ffmpeg haskell package fails to find libdc1394	haskell
magento cross selling subcategory	magento
How do I convert Cocoa co-ords from top left == origin to bottom left == origin	cocoa
How to view error messages from ruby CGI app on remote server?	apache
What is the purpose of (Apache) putting inode into an ETag?	apache
Matlab - usage of knnclassify	matlab
how can i evaluate an expression?	haskell
Vsssc and Vssscc files - usefull for SVN?	svn
Bash and Mac OS X, open application in Space N	bash
Bash TAB-completion inside double-quoted string	bash
What is the right way to modify a wordpress query in a plugin?	wordpress
jdbcTemplate hangs on long update	spring
Bash script plugin for Eclipse?	bash
Connecting Two Bash Commands	bash
What's wrong with this linq query??	linq
Testing sucess with shipping enabled vs disabled in Magento	magento
Error while generating a PDF file with Excel using C# in ASP.NET	excel
What's mean that Caused by: javax.validation.ValidationException: Unable to find a default provider ?	spring
Search and sort data from several files	bash
Saving In Magento Taking A Very Very Long Time	magento
"""SharePoint """"Group By"""" is broken when using """"Allow Multiple Values"""" for a column"""	sharepoint
IEnumberable.Except wont work, so what do I do?	linq
"""Ajax: Partial refresh of a parent page (update a div) from """"lightbox"""" window"""	ajax
Magento: Column not found: 1054 Unknown column 'e.display_price_group_0' after rebuilding flat catalog product	magento
AJAX ComboBox Control	ajax
help with Magento: Controller file was loaded but class does not exist	magento
Differences between two analytic queries	oracle
Update of of Composite Entity fails	hibernate
google opensearch plugin ajax drop down	ajax
Get log details for a specific revision number in a post-commit hook with SharpSVN?	svn
Enviroment variable within variable	bash
Can two different sites running on same host, share same database for storage and retrieval?	wordpress
writing video from webcam using opencv	osx
Have you found success with a Spring  and Hibernate Web Application	spring
Help documenting Javascript in Visual Studio?	visual-studio
Proxy URL without authentication	apache
drupal Generate a PDF catalog from a bunch of nodes	drupal
Oracle merge constants into single table	oracle
Redirect 404 to another domain with apache?	apache
"""Re-Initializing """"ThisWorkbook.Path"""""""	excel
Can an Oracle variable of type RECORD be passed between procedures without the procedures knowing its real type?	oracle
Bash or Python or Awk to match and modify files	bash
How to disable personal contact form option in drupal user account creation.	drupal
svn repository path changed: how to re-bind my local folder to it?	svn
Set Special Price Programatically In Magento	magento
Magento Developers: Is Magento really -that- good?	magento
Porting MATLAB 7 files back to 6.1	matlab
Oracle SQL Developer: sharing configuration via Dropbox	oracle
UNIX commands that support colours	bash
chroot + execvp + bash	bash
Review request and expiry notification emails for scheduled publishing pages	sharepoint
Is there any way to have the JBoss connection pool reconnect to Oracle when connections go bad?	oracle
Sharepoint: Person column in custom list	sharepoint
Un-Published items showing in Drupal search results (google search appliacne)	drupal
Parse file upload directly without writing to the file system	apache
modify comfig file using bash scirpt	bash
Browser compatibility between IE6 and IE7	ajax
Excel as database frontend for several concurrent users - doable?	excel
Svn full dump (moving servers)	svn
Remove Apache	osx
Cabal installing quickcheck version problem	haskell
What manner of Haskell syntax is used in [$parseRoutes|/ Home GET|] ?	haskell
Haskell Error: Couldn't match expected type `Integer' against inferred type `Int'	haskell
Is it possible to run q Qt Symbian application in the background and interact with the homescreen?	qt
Oracle command-line tools on Linux	oracle
In Scala, what is the difference between using the `_` and using a named identifier?	scala
What kind of category methods do you use to make Cocoa programming easier?	cocoa
Multiple sections in Content Block for Drupal	drupal
What is primitive recursion?	haskell
Magento - Create new user returns SQLSTATE[HY000] [2002] Can't connect to local MySQL server through socket '/var/lib/mysql/mysql.sock' Help?	magento
How can Set Current currency in paypal in magento?	magento
Graph/tree representation and recursion.	matlab
List all svn:externals recursively?	svn
Is it possible to add multiple commands to the readline .inputrc file?	osx
Avoiding sub-directory request rewrites with Apache mod_rewrite	apache
Looping Through Set Number of Posts in Wordpress, Then running same loop again on next set, etc.	wordpress
Wordpress - Harvard Gazette - How did they do X ?	wordpress
different using @Transactional and spring template ?	spring
Magento Connect is not working after migration	magento
Can I acheive this with linq instead of For Each?	linq
Copy and paste cells if Duplicate columns , Excel Macro slightly different question	excel
.NET VS2005 WinForms: How do i drop a user control onto a form?	visual-studio
Elegant way to highlight chart data series in Excel	excel
On QT widgets like DoubleSpinBox or ComboBox, how do i have custom right click menu	qt
Using update panel in AJAX a good practice in asp.net?	ajax
allowing anonymous user to save contents of a form in sharepoint doc library	sharepoint
CodeIgniter Backend Frontend .htaccess router	apache
Javascript if(function_foo()) doesn't wait for function_foo() to complete	ajax
How to delete files older than X hours	bash
What advantages does  C++ have over other languages for Qt development?	qt
SQL behind an external data query in Excel	excel
Remove first 4 letters from a folder name using bash scripting	bash
Binding NSSlider to control the zoom of an IKImageBrowserView	cocoa
QVariant and qRegisterMetaType question	qt
Apache is not sending 304 response, if mod_deflate and AddOutputFilterByType is enabled	apache
Adding a rule that checks if the user's role has changed?	drupal
Programmatic positioning of VBA charts has stopped working	excel
Why don't I have setTextFormat in my QTextEdit? [Qt] [C++]	qt
Resolving resx references	visual-studio
Creating Qt models for tree views	qt
Is it possible to cache a whole website including start html page and startup with no internet connection?	ajax
how to create hbm files from java files??	hibernate
What is the best way to deploy a VB.NET application?	visual-studio
drupal 6 can we write a php file in drupal which changes the headers	drupal
How to Force Javascript to Execute within HTML Response to Ajax Request	ajax
How to iterate headers of sys.net.webrequest (ajax)	ajax
Gridview item preview using .net 2.0	ajax
Apple documentation a bit lite?  tips?	cocoa
JasperReports JRBeanCollectionDataSource still confused...	hibernate
Excel 2003 XML format - AutoFitWidth not working	excel
matlab's phi symbol	matlab
Sharepoint webpart and overiding the css style	sharepoint
how to  insert a tr which is deleted from another table using jquery and ajax	ajax
What are you favourite Matlab/Octave programming tricks?	matlab
Using Linq to Sql, how can I get a particular result from a query?	linq
PHP regex expression for the following...	wordpress
awk without printing newline	bash
Where is the best documentation of Microsoft Excel Biff format	excel
Is it safe to put database file in htdocs?	apache
How do I force Visual Studio to use an Open instance when double clicking a file?	visual-studio
Problems while submitting a UTF-8 form textarea with JQuery/AJAX	ajax
DateTime Hex Format	sharepoint
Last day of the month with a twist in SQLPLUS	oracle
See binary instead of hex in Binary file while in a shell like bash.	bash
Existential Quantification over Values	scala
NSBezierPath / Line Intersection / flatten	cocoa
debugger warnings while viewing StackOverflow?	ajax
In WordPress, restrict number of posts a user can post in a day	wordpress
Hibernate: batch_size? Second Level Cache ?	hibernate
how to get the filepath when drag it from finder to a webview?	cocoa
"""Oracle: what is the """"instantclient"""" connection string format?"""	oracle
In cocoa, how can I darken everything displayed in a single NSView?	cocoa
Real-time history export amongst bash terminal windows	bash
Wordpress based website blocked by commercial proxy policies	wordpress
Tool to help write Excel formulas and IF statements?	excel
Display Ajax Loader while page rendering	ajax
Need some Drupal best practive guidance.	drupal
Find duplicate/repeated rows in hierarchical sql	oracle
What is the equivalent of 'fread' from Matlab in Python?	matlab
Wrap stray text in <p> tags	wordpress
Spring Datasource and Database Schema	spring
Visual Studio: How to trigger an alarm when a breakpoint is hit?	visual-studio
How can I sell a profile on magento?	magento
Excel/VBA to check if a row exists	excel
Wordpress is ignoring Unicode Chars in URL	wordpress
Is It Possible To Spring Autowire the same Instance of a protoype scoped class in two places	spring
Pattern matching characters for svn:ignore	svn
understanding hibernate first level cache	hibernate
print query string in hibernate with parameter values	hibernate
QT set window background	qt
Access to QTabBar instance	qt
Auto-sync Visual Studio's Class View	visual-studio
"""How can I force my SharePoint AjaxSmartPart to use the smaller """"Release"""" mode javascript?"""	sharepoint
Race condition when calling FSDeleteObject	osx
Wordpress - Create a splash screen without affecting search engine results	wordpress
SpringSecurity : always redirect logged in users to a page	spring
Magento : call a variable from customer’s shipping address in Onepage checkout, step 3 shipping method	magento
MATLAB help content for an abstract method	matlab
What plugin would you really like to have for Visual Studio 2005/2008	visual-studio
Can Visual Studio 2010 Beta be installed side by side with VS2008?	visual-studio
haskell: a data structure for storing ascending integers with a very fast lookup	haskell
What is the single best resource for learning the visual studio tools?	visual-studio
Linq to Xml: selecting elements if they're contained within an IEnumerable<XElement>	linq
Can I have a collection of IUserType instances?	hibernate
Is there a tool for emailing Shelveset's and History items from within Visual Studio Team System?	visual-studio
Matching multiple data type constructors at once	haskell
Function.tupled and placeholder syntax	scala
Overridding a Shipping Method - What am I missing	magento
Matlab postpones disp calls when doing demanding calculations why is that?	matlab
Adding Zend Framework to php.ini include_path causes Drupal site to go blank	drupal
Controlling drop down lists in Windows SharePoint Services 3.0 Form	sharepoint
SharePoint error relating to page layout after creating site from template	sharepoint
How to find and select multiple rows with macro (excel) ?	excel
MaxValue Partition Name	oracle
Why hibernate session.close() does not flushes the data automatically?	hibernate
Matlab/octave count number of operations	matlab
Convert XML based configuration to Annotations	spring
Magento get number of products for a price range	magento
"""Assume that WordPress is an almost-there CMS. What Plugins would you add to the 'core' to make it equal to """"Real"""" CMSes?"""	wordpress
Using nntool [MATLAB] from command line.	matlab
How would I express this in Scala?	scala
xml excel realtive path issue	excel
Hibernate transaction duplicate problem	hibernate
QT4: Is it possible to make a QListView scroll smoothly?	qt
Rendering Excel from browser	excel
Line of best fit scatter plot	matlab
counting duplicates in a sorted sequence using command line tools	bash
What is sql Loader...in details	oracle
Configuring Spring based servlet with sysadmin defined properties	spring
Cocoa - Suggested techniques for debugging binding problems between XCode and Interface Builder	cocoa
Setting date cell format in excel xml	excel
How Can I add additional functions to Visual Studio's Server Explorer?	visual-studio
Excel: the Incredible Shrinking and Expanding Controls	excel
Magento DataFlow Integration and Module Development Resources?	magento
sort | uniq | xargs grep ... where lines contain spaces	bash
Adding an extra column in the sharepoint list preview viewstyle	sharepoint
AW Blog (Create Bookmarklet Feature)	magento
NSPopUpButtonCell inside custom cell does not pop up when clicked.	cocoa
What happens if I don't use the --Reintegrate option in Subversion 1.5?	svn
Project (bin) folder path at compile time?	visual-studio
Function fails on the second time i call it.	ajax
Use Preferences menu item.	qt
My trigger doesn't work in updatepanel?	ajax
Looking for a web host that can handle Haskell	haskell
when close the top window ,how to let the focus to the next level window?	cocoa
Client Side Templates in javascript how to bind data	ajax
iPhone Dev: passing object from controller to a view	cocoa
What are the available options to retrieve Spring-managed beans in a Log4J Appender inside a Spring-managed web application?	spring
Docking Custom Task Panes	excel
Custom Formatting before Save Wordpress	wordpress
Altering the style of an NSSearchField.	cocoa
Problem in migrating to LAMP from XAMPP.. Memory limit error	apache
Oracle 9i: Synonymed Table Does Not Exist?	oracle
What is the easiest way to deeply clone (copy) a mutable Scala object?	scala
"""sharepoint permissions issues - """"Access Denied"""""""	sharepoint
Explanation of “tying the knot”	haskell
using the search box causes get_posts() malfunction	wordpress
Apple Event Handler Failure (Python/AppScript)	osx
How do I compile an ASP.NET website into a single .DLL?	visual-studio
Sharepoint SSL Web.Config access issue.	sharepoint
Split a database of mol2 molecules into N smaller sets	bash
Why isn't querying a JDBC-compliant database from Oracle as easy as pie?	oracle
Structuring projects & dependencies of large winforms applications in C#	visual-studio
Develop on local Oracle instance	oracle
Getting WP Functions to Return rather than Printing Immediately	wordpress
Dealing with SQLException with spring,hibernate  & Postgres	spring
Ss it possible to use CIN and QT ???	qt
In Visual Studio can i plot my variable in breakpoint ?	visual-studio
C stack overflow on Project Euler Problem 27	haskell
Do I lose change information with svn move --force?	svn
Update SubmitChanges() - does not update.	linq
"""what is the difference between ObjectQuery and """"var"""" ?"""	linq
What are the names given to these 2 LINQ expressions	linq
How to get NSImage of generic folder icon on OS X 10.5 and 10.6	cocoa
@Range based hibernate validation checks	hibernate
Oracle SYS_GUID does not change	oracle
How do I rename a Project Folder from within Visual Studio?	visual-studio
override save and load of an attribute in magento	magento
Inline editing with AJAX - how do I create multiple editable areas on the same page?	ajax
display author URL in single	wordpress
Can MOSS 2007 integrate with multiple LDAP/AD stores?	sharepoint
How can use Spring XML configuration to set a bean property with list of all beans of a certain type?	spring
Listing Apache Derby Active Connections	apache
Can't echo wp_count_posts('page')???	wordpress
How do I stop visual studio from automatically inserting asterisk during a block comment?	visual-studio
Oracle SQL*Loader getting CDATA values...	oracle
Drupal development: performance	drupal
Qt library destructor Question	qt
Is it possible to recreate IKEA's functionality using Ajax?	ajax
Dynamic DNS on your own server	apache
Bash: Convert non-ASCII characters to ASCII	bash
Solve ODE without nested functions	matlab
PHP Error handling in WordPress plugin	wordpress
Performance issue with QGraphicsScene::createItemGroup	qt
Sharepoint updating custom database	sharepoint
Add property to LINQ that is combination of multiple tables?	linq
Replace important symbolic link ‘safely’	bash
Am I using NSTimer correctly in iPhone View-based app?	cocoa
override activexobject	ajax
excel string comparison is failing when it should not	excel
Linq to Sql - return selected specified columns	linq
Cocoa Application Help	osx
Drupal hook priority	drupal
PL/SQL function to return string with regexp special chars escaped	oracle
Can subversion be hosted on amazon's hosted cloud?	svn
How to use Spring to inject an object in a setter that doesnt follow the Java bean specification ?	spring
How do you close Excel com object and save the work?	excel
Can optimizations affect the ability to debug a VC++ app using its PDB?	visual-studio
Event Receiver for Document Library	sharepoint
In what scenarios is LINQ best applicable?	linq
notification when alter occurs on oracle database	oracle
when updating a whole project's root, how to exclude svn externals from being updated?	svn
How could I cache images that I'm pulling from a magento database through ajax?	magento
How to make all connected browsers reload initiated by a server-side event	ajax
What do the letter suffixes on SVN version numbers mean?	svn
Does OpenId support Ajax login?	ajax
Install macruby to specific directory?	osx
Spring-MVC is adding on an extra .jsp extention to the URL a user enters	spring
An online SVN client	svn
spring session scoped bean value empty?	spring
Drupal: Associating grouping more than one CCK field.	drupal
Subversion on Mac - refuses to get password from keychain	osx
Fully unrap a view	oracle
Create a new field and update a content type (and all implementations)	sharepoint
osx change file encoding (iconv) recursive	osx
How to Capture / Post system-wide Keyboard / Mouse events under OSX ?	osx
Guidance on creating non conflicting workflows	sharepoint
What software to use for virtual machine for Windows development?	osx
What do you use to develop for PowerShell?	visual-studio
best practice for loading necessary JSON data: jquery's $(document).ready() hook? in the <HEAD> of page?	ajax
SVN diff across 2 different repositories	svn
Haskell: scary type signature	haskell
P tag is not displayed in html editor for Wordpress	wordpress
How to profile methods in dependent assemblies in a unit test instrumentation performance session?	visual-studio
spring roo backup command lost my files	spring
XL VBA - Passing an array in a user defined function?	excel
Managing Wordpress blog on development and live environment	wordpress
Saving different csv files as different sheets in a single excel workbook	excel
Capturing title change event on SPWeb	sharepoint
Connect to the Magento API using C#	magento
A good way to send complex objects with ajax?	ajax
Change Revesion Number in Subversion, even if the File not change in the commit.	svn
Self-modify the classpath within a Scala script?	scala
on submit action	spring
Parse players currently in lobby	bash
Suggested resources for learning about blocks in Snow Leopard	cocoa
Excel: how to create a number in a column according to a text value in other column?	excel
Whats the best, most simple ajax file uploader?	ajax
QT & UDP-Socket	qt
Jquery Ajax Returned Array - how to handle in Javascript	ajax
Excel Embeded If Statements	excel
Possible to override site creation in Sharepoint?	sharepoint
Synchronize SVN through FTP	svn
Can pysvn 1.6.3 be made to work with Subversion 1.6 under linux?	svn
Should I use QCoreApplication::processEvents() or QApplication::processEvents()?	qt
QThread issues. Crash after 2058 runs.	qt
Subversion as version-incrementor at each commit?	svn
How to replace xml content in conditionally selected elements using linq (VB 2008)	linq
Custom File Filter Upload	drupal
Creating drupal pages (nodes) automatically from other (xml) content	drupal
How To Prevent Tab Hell With Visual Studio And FireFox Debugging?	visual-studio
Using Google Table inside jqueryui ajax tab	ajax
"""How can svn co give a """"directory already exists error""""?"""	svn
Can't get wordpress feed to display full article...	wordpress
A think on sum(X, 1)	matlab
suPHP upgrade causing 500 internal server error	apache
Intelligent Keyword Searching	drupal
how to print just the popup window	drupal
Using haskell read and typeclasses - ambiguous type variable error	haskell
Magento google products site html help	magento
Is there any way to pass an NSArray to a method that expects a variable number of arguments, such as +stringWithFormat:	osx
MIDL generates the same file for /env win32 and /env win64	visual-studio
Is there any Wicket-like web framwork to use with Scala (not lift)?	scala
I already have PHP installed, what's the easiest (best) way to get GDLib installed?	osx
Silverlight 3 - RIA Services and LINQ	linq
Naming convention for Qt widgets	qt
Wordpress: Accessing A Plugin's Function From A Theme	wordpress
Excel: Create a new sheet for each row	excel
Linq - sum child field value when child records query ganareted by diffrent func	linq
How to select specific fields with aliases using joinTable or joinField in Magento	magento
"""""""The selected files was not found"""" on an InfoPath form in Sharepoint"""	sharepoint
or is not valid C++ : why does this code compile ?	qt
SVN : Get All Files From A Revision	svn
Hibernate Save strange behaviour	hibernate
Adding Event to YUI Rich Text Editor	drupal
Getting the caller to a Spring AOP Proxy	spring
can a magento adminhtml field depend on more then one field or value?	magento
Can you set VS2008 to break on an error inside a try-catch statement	visual-studio
Check if application was started from within Visual Studio	visual-studio
Reverse Ajax without Comet?	ajax
How to add Remember me function at custom login box ?	wordpress
Working with Anonymous Types with Linq in VB, C#	linq
Problem with URL rewriting for same .php page	apache
Current user in Magento?	magento
Using SVN to lock documents for editing and update notifications	svn
Why is [String] the inferred type when there are no lists visible in the code?	haskell
Python - Virtualenv , python 3?	osx
Spring RDBMS vs JDBCTemplate	spring
Avoiding, finding and removing memory leaks in Cocoa	cocoa
Alternate method to kron	matlab
Does this linq query runs on every iteration of the for-each loop?	linq
explain largestDivisible code from the Learn You A Haskell for Great Good tutorial	haskell
Bash Scripting and bc	bash
AJAX popup causes screen to re-load using ASP.Net	ajax
QtWebKit, QWebElement::setPlainText() problem	qt
Best way to export a QTMovie with a fade-in and fade-out in the audio	osx
Plotting Bessel functions	matlab
Oracle Update Hangs	oracle
mangento in postgres or oracle database ?	magento
My oracle listner to shuts itself down, what could be happening?	oracle
Is it possible to develop Mac OSX apps on Windows?	osx
During Spring unit test, data written to db but test not seeing the data	spring
Why does a SelectionKey registered to a DatagramChannel return a SelectableChannel in Scala but not Java?	scala
WordPress Post Date Changes On Update	wordpress
NSPredicate case-insensitive matching on to-many relationship	cocoa
Can I use a scala class which implements a java interface from Java?	scala
VSeWSS problems when creating a new base class which inherits from SPItemEventReceiver	sharepoint
List files of certain pattern using Excel VBA	excel
How would you migrate hundreds of MS Access databases to a central service?	oracle
Access Excel Programmatically	excel
Programatically create web application & sub site	sharepoint
Bash script to setup a temporary SSH tunnel.	bash
Is my IQueryable syntax correct?	linq
View more link should display next 3 records instead of displaying new page	ajax
Making an NSAlert be displayed when the User attempts to delete a row from an NSOutlineView when it has children.	cocoa
"""""""Pivoting"""" a Table in SQL"""	oracle
"""How do i build a custom """"Your Account"""" dynamic page with wordpress?"""	wordpress
Performing operations on (specifically how to add a List of) Long in Scala	scala
"""Mapping Hibernate """"Custom"""" Subclasses"""	hibernate
Best way to add python scripting into QT application?	qt
Load any file type  into matlab	matlab
How can you use ajax within an object to populate the object's instance variables?	ajax
Very slow response for Visual Studio 2005 Web Site Administration Tool	visual-studio
EntityManager refresh problem	spring
Best project format for VS2005 + SharePoint deployment?	sharepoint
What is the purpose of type ascription in Scala?	scala
Apache2 isn't serving index.php	apache
Find float in a text file	bash
bash loop between two given dates	bash
Is it possible to get the SQL alias of a join table for a Hibernate sqlRestriction?	hibernate
Refresh Using Ajax/PHP	ajax
Linq to XML - way to write binary Data into XML	linq
Is there any best practices for Visual Studio Project/Solution Structure?	visual-studio
Password Protected Wordpress MU	wordpress
Apache Caching within diffrent VirtualHosts	apache
Spring rejecting bean name, no URL paths specified	spring
hibernate one-to-one or component?	hibernate
Whether to enable a security-protected feature	excel
Visual Studio or Eclipse - which one is better for Qt on Windows?	qt
Mean filter in MATLAB without loops or signal processing toolbox	matlab
Why does ghci say that 1.1 + 1.1 + 1.1 > 3.3 is True?	haskell
Drupal | How do you integrate a module into views?	drupal
