text	label
I accidentally made a payment from the wrong account yesterday. It's my rent payment, and it's very large, so the account I paid from won't be able to cover the amount. It's really important that the payment be made from the right account?	cancel_transfer
I mistook my pin and now I am locked.  Can you unlock me?	pin_blocked
Can you tell me more about limits to disposable virtual cards?	disposable_card_limits
The ATM at Metro bank on High St. Kensington didn't return my card, and the bank is now closed. How do I get back a card swallowed by an ATM?	card_swallowed
I was the victim of someone stealing my wallet.  My card is being used and it isn't me.  What should I do?	cash_withdrawal_not_recognised
Dude I put money in the ATM last week but it ain't there! I need the money now figure this out!	balance_not_updated_after_cheque_or_cash_deposit
how do i see what i transferred	balance_not_updated_after_bank_transfer
What are these fees i am paying?	card_payment_fee_charged
Can you tell me how to locate my PIN?	get_physical_card
Even though I added money ey to the card, I couldn't use it	pending_top_up
Could you tell me why my cash withdrawal was declined?	declined_cash_withdrawal
The balance has not been updated.	balance_not_updated_after_bank_transfer
There is a payment done with my card which i definitely did not do.Never seen that name before.	card_payment_not_recognised
tell me how I can order my card.	order_physical_card
Can I go ahead and use my account even though my identify hasn't been verified yet?	why_verify_identity
Someone else accessed my account and made a payment.	card_payment_not_recognised
Can you tell me if a credit/refund is coming from a seller? I asked for refund directly from them and am still waiting. It's been a week now and i still havn't seen my refund yet.	Refund_not_showing_up
What's the normal time frame for a transfer from a UK account? After just making a transfer it doesn't appear at all. I need to know if things went okay.	balance_not_updated_after_bank_transfer
One of my charges was declined, but the second one went through.  But I notice on my App that one of them has gone through, and the other one is still pending.  Please ensure that only one charge is processed. Thanks	transaction_charged_twice
Do you support top ups?	top_up_reverted
Am I able to track a card that has already been sent?	card_arrival
I didn't receive the correct amount of cash when I exchanged it overseas.	wrong_exchange_rate_for_cash_withdrawal
I have foreign currency i would like to change how much will it cost me?	exchange_charge
Do I receive the physical card for free	order_physical_card
HOW LONG TO TAKE THE TIME TO SOLVE	card_not_working
How can I use my American Express to add money into my account?	supported_cards_and_currencies
why hasnt my card come in yet?	card_arrival
Hi, I am experiencing problems while trying to top-up with my card. I have never experienced any problems doing this before. Could you please help me?	top_up_failed
What kind of fees will I pay when I transfer?	transfer_fee_charged
I bough an item and the exchange rate was incorrect.	card_payment_wrong_exchange_rate
I'm happy with Mastercard and want to stick with just that credit card.	visa_or_mastercard
For topping-up is there a charge?	top_up_by_bank_transfer_charge
Is there something wrong with the ATM? It would not let me pull cash out of my account.	declined_cash_withdrawal
I want my card frozen right away. Money was taken out in an odd location I have never heard of.	cash_withdrawal_not_recognised
There is a debit paymet that I don't recognize.	direct_debit_payment_not_recognised
At which locations can I order a card?	order_physical_card
I wanted to know what discounts were offered for current exchanges as it is something that occurs frequently.	exchange_charge
I just got a new card how do I get it to start working?	activate_my_card
How can i get new card?	contactless_not_working
Please explain why my transfer attempt was declined. Thank you.	declined_transfer
There is a fraudulent payment!	card_payment_not_recognised
I see I was charged extra when I used the card.  I am not sure why, please tell me why.	card_payment_fee_charged
What is necessary for the identity verification?	verify_my_identity
what is the age limit for opening a new account	age_limit
I topped up and went to buy something, but it says that my funds are pending. Is there a way to quicken this process?	pending_top_up
My account did not allow the transfer.	beneficiary_not_allowed
Why hasn't my in country transfer gone through yet? I confirmed the account info a couple days ago but the payment hasn't been posted yet.	transfer_not_received_by_recipient
My credit card for was not approved for a top-up transaction.  What happened?	top_up_failed
Why did you give me so little currency?	wrong_exchange_rate_for_cash_withdrawal
What are the steps for  making a transfer for topping up?	transfer_into_account
Are there limits to businesses that will accept this card?	card_acceptance
Do you know the rate of exchange?	exchange_rate
I'm expecting a large refund from a store I returned merchandise to recently.  They say they have sent the money but I don't see it in my account, can you help.	Refund_not_showing_up
Tell me how I can verify a card top-up.	verify_top_up
If I can't choose my card type will I be able to use it everywhere?	visa_or_mastercard
Is there a way to make my money usable in another country?	exchange_via_app
What went wrong with my transfer?	declined_transfer
A pending charge of 1L appears on my statement.  Please explain as I have not made a purchase for that amount	extra_charge_on_statement
extra fees on a cash withdrawal, not cool.	cash_withdrawal_charge
How quickly can I transfer something to China?	transfer_timing
There is a potentially fraudulent direct debit on my account.	direct_debit_payment_not_recognised
What's the expected wait time to recieve my new card?	card_arrival
Weird Direct Debit payment	direct_debit_payment_not_recognised
can i deposit a check here?	top_up_by_cash_or_cheque
Unknowingly to me the payment sent to seller has been redeposied back in my account. I do not know why it would take out the payment and then put it back in my account. Can you resolve this as soon as possible?	reverted_card_payment?
Can i get money back in my home currency at  ATM? As I am on holiday and bit concerned because i do not have any cash with me . Is it possible to withdraw without any additional cost.	wrong_exchange_rate_for_cash_withdrawal
Why is this not letting me exchange crypto? I need help making this transaction go through.	beneficiary_not_allowed
Can we skip verifying?	why_verify_identity
do you offer refunds? i would like to return purchase.	request_refund
ATM is broken. It did not give me the full amount (30 pounds.)  I'm standing here with only 10 pounds and it's telling me it gave me 30 pounds. I need assistance now!	wrong_amount_of_cash_received
Can I call to get my card activated?	activate_my_card
I tried to use my card today in the restaurant but it didn't work and just got declined. What's wrong?	card_not_working
If I am not in the country and I need to change my PIN, how can this be done?	change_pin
I still want to use my account but haven't verified is that OK?	why_verify_identity
Transfer isn't working?	failed_transfer
Are physical card available?	order_physical_card
Instructions for activating card	activate_my_card
If I exchange currencies on a frequent basis can I receive a discount?	exchange_charge
Okay, I found my card, can I put it back in the app?	card_linking
Where is the tracking number for the card?	card_arrival
"""I get a """"decline"""" message when doing a transfer"""	declined_transfer
Could you please help me figure out why the seller has not received their money after I sent it.	pending_transfer
How long does it typically take to make a transfer from a UK bank? I just made one and it hasn't shown up in my account yet.	balance_not_updated_after_bank_transfer
i have used my card online before and wasn't charged, why am i charged now	card_payment_fee_charged
There is a direct debit payment I don't recognize.	direct_debit_payment_not_recognised
I can't find the money I just added to my account.	pending_top_up
The app passcode has completely slipped my mind.	passcode_forgotten
Which currencies will you exchange?	fiat_currency_support
i tried using a virtual card for a hotel but it didn't work, why not	disposable_card_limits
I can't access my account.	passcode_forgotten
It shows that the transfer on my account wasn't allowed.	beneficiary_not_allowed
unsupported transfer declined	declined_transfer
I am trying to find out how to exchange currency X with currency Y.	exchange_via_app
What are my payment options for topping off my account?	top_up_by_cash_or_cheque
Why was I charged an additional fee when paying with card?	card_payment_fee_charged
Can you walk me through how I can edit some of my personal information?	edit_personal_details
When will the cash that I put in the ATM be cleared from pending status?	pending_cash_withdrawal
I need some help now please! There are some transactions on my account that I do not remember purchasing. Can they be reversed? Can you please cancel or freeze my card so I don't keep getting charged?!	card_payment_not_recognised
Can I get some help to get me card activated?	activate_my_card
where are the transfers originating	verify_source_of_funds
Can I have a tangible form of my virtual card.	order_physical_card
What fiat currencies are used for exchange?	fiat_currency_support
How long do EU transfers take? I bought something online a couple of days ago , sent the money immediately online but the seller says it is still not there yet.	pending_transfer
How much can I withdrawal in one month without incurring fees?	cash_withdrawal_charge
I think someone stole my card number and brought stuff in different places that I have never been to. I need to suspend any further purchase on my credit card.	compromised_card
Reasons for top up cancellation.	top_up_reverted
is there a way to change name?	edit_personal_details
Hi, I'm in progress of purchasing a flat and am trying to make to make a payment.  An error is appearing, and I need assistance.	failed_transfer
Where can I do a cash withdrawal?	atm_support
How can I fund another account with my American Express?	supported_cards_and_currencies
Why did you charge me extra for withdrawing money?	cash_withdrawal_charge
I can't recall my password.	passcode_forgotten
Do you give refunds?	request_refund
I lost my wallet and all my cards were in it.	lost_or_stolen_card
I put the wrong pin too many times and now it is blocked. Can you help me unblock it?	pin_blocked
It does not appear that my message went through.	top_up_failed
My card has been found. Is there any way for me to put it back into the app?	card_linking
What is this direct debit in my statement?	direct_debit_payment_not_recognised
I don't know my password	passcode_forgotten
There was just a withdrawal but it wasn't me, I've never even visited the town where the withdrawal happened.	cash_withdrawal_not_recognised
i'm not satisfied with the services and no longer want to be a customer	terminate_account
I've been waiting for over an hour for a top up to go through.  How long is this supposed to take?  I really need this money.	pending_top_up
"Where can I withdraw money from?"""	atm_support
I would like to exchange currency  What types are there?	exchange_via_app
How do I re-order a damaged card?	card_not_working
When will my cheque be processed?	balance_not_updated_after_cheque_or_cash_deposit
In the app I see a direct debit that I don't recognize.	direct_debit_payment_not_recognised
I was wrongfully charged one pound.	extra_charge_on_statement
How long will my top-up stay pending?	pending_top_up
Hi, i found a large amount payment in my old statements which i am sure was not made by me. I am aware that the time has passed but is there a way to raise a dispute for this payment now?	direct_debit_payment_not_recognised
I didn't initiate a direct debit that I see on my account	direct_debit_payment_not_recognised
Are money transfers free?	transfer_fee_charged
How long does it take for a cheque to post to your account?	balance_not_updated_after_cheque_or_cash_deposit
I used my card to top up, but the money is not there!	topping_up_by_card
I am waiting on the refund	Refund_not_showing_up
It kept my cash	wrong_amount_of_cash_received
It's been a couple days how much longer do I have to wait for my transfer?	transfer_timing
Can I use my account now, even though my identity verification has not gone through yet?	why_verify_identity
Hello, I have a question concerning an unfamiliar fee that I notice on my account. I see that you guys charge for ATM withdrawal. Never notice this fee until now. Can you please explain?	cash_withdrawal_charge
the balance has not changed, but I have deposited some money	balance_not_updated_after_cheque_or_cash_deposit
Transfer has failed.	failed_transfer
Help! I just realised someone has apparently withdrawn money using my card! It's from some odd remote town where I definitely haven't been. Please freeze it immediately!	cash_withdrawal_not_recognised
How long will it take for me to get my card?	card_arrival
Why hasn't my balance been updated from the check deposit I made?	balance_not_updated_after_cheque_or_cash_deposit
Good day, in reviewing my credit card activity over the last several days, I see a repeated charge for a restaurant that I went to. The charge was put through twice, so I would like one of the charges corrected and the amount that was withdrawn to be reinstated please.	transaction_charged_twice
I was overcharged at an ATM while on vacation. I needed cash so I had to use it, but your charges are outregous and I wish I would have known beforehand.	wrong_exchange_rate_for_cash_withdrawal
I don't understand where this charge came from.	card_payment_not_recognised
I have done a transfer within the country the day before yesterday, but it's still not there yet. Can you please check what's going on with that, the account number is the right one, I've checked that several times already.	transfer_not_received_by_recipient
It appears my top-ups have been canceled.	top_up_reverted
What is the most that I can top-up to a card?	top_up_limits
Is there a fee for paying by card?	card_payment_fee_charged
I've tried several times to make a payment and every time my card is declined? Could my card be locked? I don't know what to do.	declined_card_payment
The exchange rate you're using is terrible - this can't be the official interbank exchange rate, can it?	card_payment_wrong_exchange_rate
My money hasn't been transferred yet.	balance_not_updated_after_bank_transfer
I tried activating my plug-in and it didn't piece of work	activate_my_card
when will I get my refund?	Refund_not_showing_up
Why did they take more money out then I withdrawed?	cash_withdrawal_charge
Is there a way I can have a mastercard?	visa_or_mastercard
Anytime I've made an ATM withdrawal before it has always been free. I now say that I have been charged for my most recent ATM withdrawal. What's going on here?	cash_withdrawal_charge
I was recently mugged and would like to know if I have to have access to the app to use your services and how I would go about setting up your services on a new device belonging to a current user?	lost_or_stolen_phone
What caused my cash withdrawal to be declined?	declined_cash_withdrawal
What do I do now that I can't use this card?	card_not_working
I am still waiting for a refund	Refund_not_showing_up
What fiat currencies are used with holdings and exchanges?	fiat_currency_support
I want to add funds to my account. What payment methods are accepted?	supported_cards_and_currencies
I accidentally chose to exchange GBP, but I need to pick AUD. How can I change it?	exchange_via_app
When can I expect my transfer to reach my account?	transfer_timing
I exchanged Russian rubles for British pounds today and got less than I expected. Was exchange rate correct?	card_payment_wrong_exchange_rate
It seems like I have been waiting forever for this international transfer. Why is it taking so long? C'mon, it's 2018, things happen at a click of a button. All of the account information is correct, so how long will this take?	pending_transfer
Is there a charge for sending out more cards?	getting_spare_card
Do international transfers take longer?? I made a transfer from France 2 days ago but it's still not there yet...	balance_not_updated_after_bank_transfer
I need several cards per day. And I need to be able to throw away all of the cards I make.	disposable_card_limits
Why can't I take money from my account?	declined_cash_withdrawal
Transfer was declined.	declined_transfer
A few hours ago I made a bank transfer from my UK account but I don't see that it has arrived.   Can you check and see if all is ok please?	balance_not_updated_after_bank_transfer
Do EU transfers happen quickly? I purchased something a few days ago and the seller hasn't received my money yet.	pending_transfer
Is there a fee for sending out more cards?	getting_spare_card
Do I have to use bank approved ATM's	atm_support
I just moved overseas and I noticed that you are charging me more fees.  I am a loyal customer, is this how you expect to keep customers?	transfer_fee_charged
Can my account me accessed by a thief?  I was mugged.	lost_or_stolen_phone
My identity is unable to be verified.	unable_to_verify_identity
Tell me how to verify a top up.	verify_top_up
I am entering my passcode but getting an error.	passcode_forgotten
Can you please explain how bank transfers work?	transfer_into_account
How many cards am I allowed?	getting_spare_card
The activation process did not work, please help?	activate_my_card
Where to check top ups pending?	pending_top_up
Hi. Please can you help me fix a double charge on my card? I'm looking at my transactions and this restaurant I went to earlier in the week has charged me twice! Please remove the additional charge for me.	transaction_charged_twice
My friend deposited $100 into my account, but it is not showing up!	balance_not_updated_after_cheque_or_cash_deposit
Why is allowance not being given to my beneficiary?	beneficiary_not_allowed
When I used one of the ATMs in the city centre today, I tried to take out some money, but for whatever reason, the machine declined my card. Just checked it out in my account and that amount is still showing as pending! Is there any way that you can cancel this transaction, because I did not receive any money whatsoever from the ATM	pending_cash_withdrawal
Top up keeps failing	top_up_failed
Hae there, I have a transaction that is in progress despite the fact that the ATM was not working, what do I do to avoid being charged?	pending_cash_withdrawal
should i add money via bank transfer instead	top_up_by_card_charge
Please help me with my card payments which keeps getting reverted whenever i do online shopping. I am having this problem since last two weeks.	reverted_card_payment?
What is the refund process?	request_refund
How long do top-ups take to go through	pending_top_up
Why have my top ups been canceled?	top_up_reverted
Where did my top-up go? I can't find it in my wallet	topping_up_by_card
I need to know if everything is okay here. After making a transfer from a UK account it doesn't show up. How long does this normally take to process?	balance_not_updated_after_bank_transfer
I've used my account frequently over the last month to manage my payments from abroad for my new place. I noticed that my fees have suddenly increased. As a frequent customer, shouldn't I be rewarded rather than suddenly being subject to a new fee?	transfer_fee_charged
there is a charge i dont recognize	card_payment_not_recognised
What is your age limit?	age_limit
What do I do if I find a debit charge that I know I didn't do in my billing statement?	direct_debit_payment_not_recognised
Why do you ask for top-up verification?	verify_top_up
I have received my statement but I do not see my refund, why is that?	Refund_not_showing_up
I would like to track a card sent to me, how do I do that?	card_arrival
I'm having issues with my card. You guys keep declining it for some reason. I haven't had any issues up until this point. What is going on? I've tried a handful of times with the same, unfortunate, result!	declined_transfer
I got a notice from my app that I withdrew cash but I don't remember doing so. How do I fix this?	cash_withdrawal_not_recognised
My identity wasn't verified	unable_to_verify_identity
Why can't I transfer my money into someone else's account? I should be able to do so right? Why does it keep rejecting my transfer? There's no reason, all my info is correct and the money is there.	failed_transfer
"I put the wrong pin too many times and now it is blocked. Can you help me unblock it?"""	pin_blocked
I thought I knew my password but I guess I was wrong, what can I do now?	passcode_forgotten
need to know places i can withdraw money	atm_support
How can we correct a mistake on an ATM transaction?  The app shows what I should have gotten.	wrong_amount_of_cash_received
Why was my withdrawal requested cancelled by the ATM?	declined_cash_withdrawal
Why is my ATM cash withdrawal not working?	declined_cash_withdrawal
My account balance has not updated since I deposited a cheque recently.	balance_not_updated_after_cheque_or_cash_deposit
The ATM only gave me 10 pounds when I withdrew 30. What do I do?	wrong_amount_of_cash_received
I went to use my new card today and the card was repeatedly declined. I would really like to use this card and need to know what to do about it.	declined_card_payment
Could you refund my transaction, I paid it into the wrong account. I need to be able to pay it into the right account by tomorrow.	cancel_transfer
I had a cheque deposited, but I don't see my money yet?	balance_not_updated_after_cheque_or_cash_deposit
My transfer was not approved	declined_transfer
Does it cost anything to buy something from another country? Like is there going to be hidden transfer fees or currency conversion fees?	transfer_fee_charged
I'm currently not in possession of my phone, is it still possible to go about things normally without access to the app?	lost_or_stolen_phone
my card was frozen due to putting in the wrong pin too much.  how many tries do i have	declined_cash_withdrawal
virtual card won't work for me	virtual_card_not_working
which identity details are required	why_verify_identity
Hi, I sent my landlord my rent money a few days ago and while everything seems good on my end he says that he never got the money. I double checked the account number and it's correct. Can you help me figure this out?	transfer_not_received_by_recipient
What methods are available for my friend to send me money?	receiving_money
I was out today looking forward to paying with my brand new card, turns out the payment just kept getting declined. This is pretty sad, what's going on?	declined_card_payment
I think youre system may be broken because I have tried transfer money 5x and it isnt working!  I'm not doing anything complicated it is what I usually do.	failed_transfer
how can i track card you sent	card_arrival
Why can't I withdraw funds from my account?	declined_cash_withdrawal
ATM withdrawal not working.	declined_cash_withdrawal
Is my child too young to sign up?	age_limit
Why am I being a charged for using my card?	card_payment_fee_charged
I've just made a money transfer to the wrong account, I need to stop the money from being moved as it may be going to someone I don't know.  Please can you help?	cancel_transfer
What are then rules on beneficiaries?	beneficiary_not_allowed
How can I dispute a direct debit charge on my account?	direct_debit_payment_not_recognised
I believe you charged me too much to exchange my money	card_payment_wrong_exchange_rate
my friend has not got the money I sent last week.	transfer_not_received_by_recipient
My rate of exchange was wrong.	card_payment_wrong_exchange_rate
Please help me with the activation of the new card.	activate_my_card
I'm interested in getting a card. How does one go about doing that?	order_physical_card
Hello, i just checked my statement and there seems to be a payment from my card that I have never seen before.	card_payment_not_recognised
Transferred to account is not successful, help please?	balance_not_updated_after_bank_transfer
The app isn't showing my transactions	transfer_not_received_by_recipient
Do you accept SWIFT transfers?	top_up_by_bank_transfer_charge
What could possibly be the cause of my failed transfer?	failed_transfer
I can't freeze my account as I need the card as I am traveling, how do I change my pin?	change_pin
am suspicious of my card's security	compromised_card
the money i transferred didnt arrive	transfer_not_received_by_recipient
Why is my disposable card not working?	virtual_card_not_working
If I find a card I lost do I need to dispose of it? Or can I re-active the card and continue to use it?	card_linking
My son has just turned 13, is he old enough for an account?	age_limit
I don't like the services, please close my account	terminate_account
Hey i need help urgently. I just realised I sent my payment to the wrong account number, there is a typo! Please cancel it immediately, I can't do it anymore from the app	cancel_transfer
I am out of money in my account and I was wondering if I could do a bank transfer is put more in it?	transfer_into_account
If I add money with an international card, are there any fees?	top_up_by_card_charge
I need help as fast as possible! I made a mistake on my most recent transfer; can you please stop it before it goes through?	cancel_transfer
What are the steps to finishing up with this account?	terminate_account
Can I use my card at an ATM?	atm_support
I no longer want to transfer funds, can we cancel that transaction?	cancel_transfer
My card got blocked, how do I reset?	pin_blocked
