text	label
My credit card payment has been in pending status for a super long time.  I don't get it.  Why is it like this?  When will it go through?	pending_card_payment
Can you tell me what i steps i should take since my card was stolen?	lost_or_stolen_phone
What do you demand for identity verification?	verify_my_identity
What foreign exchange rate will I get?	exchange_rate
I see a direct debit that isn't mine? How can I get my money back?	direct_debit_payment_not_recognised
It's been over a month and i still haven't received my goods! I ordered a pencil for crying out loud, it's not that hard to deliver that! I'm done with these people, give me a refund immediately! I'll search for my Japanese exclusive pencil elsewhere!	request_refund
I have a charge for something I didn't buy.	card_payment_not_recognised
I have a strange transaction on my account which appears to pertain to a cash withdrawal I made outside Nandos in Leeds.  What is that for?  Is it fraud?	cash_withdrawal_charge
Why was my account assessed a fee?	extra_charge_on_statement
Are there virtual disposable cards?	get_disposable_virtual_card
My purchases from this morning are showing up as payment pending. Can you tell me why?	pending_card_payment
The ATM I'm standing in front of only gave me 10 pounds rather than the 30 pounds I wanted. The app shows I took out 30 pounds also. What do I need to do to fix this?	wrong_amount_of_cash_received
I was attempting to top up with my card but the money has vanished!	topping_up_by_card
I must make several disposable cards every day.	disposable_card_limits
My card payment has been stuck on pending. What is the problem? It should have gone through by now.	pending_card_payment
What's the procedure for canceling a purchase?	request_refund
I was under the impression I can make transfers for free. I made an online purchase for something that was obroad and there's some additional strange fee. I've never seen this before and this isn't fair.	transfer_fee_charged
Please help my find out why there is an odd direct debit in my records.	direct_debit_payment_not_recognised
I cannot get to my app, what should I do?	lost_or_stolen_phone
I deposited money in the form of a cheque, but my balance has not increased.	balance_not_updated_after_cheque_or_cash_deposit
Are you located in other countries?	country_support
The ATM will not let me get cash, WHY?	declined_cash_withdrawal
Someone must have found my card details as I don't recognize these transactions.	compromised_card
I do not understand what this particular direct debit is ?	direct_debit_payment_not_recognised
What form of payments can I use for topping up?	top_up_by_cash_or_cheque
If I want my son to have his own account is that possible?	age_limit
Since when were there charges for taking out cash from my account? It's always been free for me to do this before.  How much are the charges going to be?	cash_withdrawal_charge
Is there a charge for transfers?	top_up_by_bank_transfer_charge
Please help revert my transaction from this morning.	cancel_transfer
Why is my card being declined when I try to do a top-up? How can this be immediately resolved?	top_up_failed
My statement shows a 1£ purchase pending. I do not remember making this purchase, please let me know what this is about.	extra_charge_on_statement
I just looked over my statement and I don't recognize the name of a card payment.	card_payment_not_recognised
I can't see a refund for a return I completed recently.	Refund_not_showing_up
Are there any restrictions on the disposable cards?	disposable_card_limits
what is this fee for transfering	transfer_fee_charged
Why has my beneficiary been denied?	beneficiary_not_allowed
Can you tell me why the card payment came back?	reverted_card_payment?
Why and I being charged this fee?	card_payment_fee_charged
Why would I receive an error that my transfer isn't possible when I've done it before?	beneficiary_not_allowed
My purchase used the wrong exchange rate	card_payment_wrong_exchange_rate
I don't remember my login code	passcode_forgotten
Good afternoon. I made a transfer from my UK bank account.  I haven't seen anything on the account in the pass few hours. Please check the account to make sure everything is fine.	balance_not_updated_after_bank_transfer
Hello,  In my most recent ATM transaction, I didn't receive nearly as much cash as I thought I would - what is your exchange rate policy?	wrong_exchange_rate_for_cash_withdrawal
My bag got stolen with all my cards. Can you please cancel my card and send a new one?	lost_or_stolen_card
Hi need your help for getting the refund or cancel the payment of an item, i have ordered but still have not received it.	request_refund
I have a new card and need to activate it	activate_my_card
I think I was charged a different exchange rate than what was posted at the time.	wrong_exchange_rate_for_cash_withdrawal
I'm being charged for using my card!	card_payment_fee_charged
My cash withdrawal shows pending, why?	pending_cash_withdrawal
I want to start using my card, how do I activate it?	activate_my_card
What's going on with my card? I've tried multiple times and it never goes through.	card_not_working
What is the longest that a payment will show pending?  There is one showing that has been sitting there a few days.	pending_card_payment
Is the fee with my cash withdrawal a mistake?	cash_withdrawal_charge
Which ATM's can I use to make a withdrawal?	atm_support
Why is verifaction required for my Identity?	why_verify_identity
Please help me in this, as i was unable to make any payment by my new card,  it was getting declined repeatedly. I am not very happy with this incident.	declined_card_payment
My top up keeps showing pending?  How long will things be like this?  Days, weeks, months?  I need the money quite urgently for an important coffee purchase, can you please let me know when top up will work?	pending_top_up
Is the EUR accepted for exchanges?	fiat_currency_support
how should i add money to my card	top_up_by_card_charge
There was a charge made on my card from a couple weeks ago and I don't remember making the purchase. Nor do I remember the company itself. Can we trace this at all to confirm if I did it or not?	direct_debit_payment_not_recognised
Which fiat currencies do you currently support? Will this change in this future?	fiat_currency_support
I need an accurate exchange rate, when I make my withdrawals.	wrong_exchange_rate_for_cash_withdrawal
So I've been using my account frequently to manage payments for my vacation house in a different country, and now I'm getting hit with ridiculously high fees! What's with that? Ought not I be rewarded as a frequent user?	transfer_fee_charged
How long does a transfer from a UK account take? I just made one and it doesn't seem to be working, wondering if everything is okay	balance_not_updated_after_bank_transfer
I need to do a card activation.	activate_my_card
I tried to withdraw $100, all it gave me was $20.	wrong_amount_of_cash_received
I've tried many times to make a payment, but it's not going through.  What's wrong?	declined_card_payment
what is this charge on my card?	direct_debit_payment_not_recognised
How long does it take for money to reach my account?	balance_not_updated_after_bank_transfer
Where is my pin? I don't have it yet	get_physical_card
where can I see who sent me funds	verify_source_of_funds
My card has been pending for a while, what should I do?	pending_card_payment
I returned something to a  store but can't see my refund.	Refund_not_showing_up
I made a transfer a couple hours ago but my balance has not been updated. Why is this? Shouldnt this be instant?	balance_not_updated_after_bank_transfer
My statement contained a one pound extra fee	extra_charge_on_statement
I need you to stop the transfer I just started as soon as possible, I just realized it's not correct!	cancel_transfer
It says the transfer wasn't accepted.	declined_transfer
Foreign currency rates were put in wrong at an ATM i used.	wrong_exchange_rate_for_cash_withdrawal
I have a problem with a transfer. It didn't work. Can you tell me why?	declined_transfer
I am being charged the wrong amount on my card.	card_payment_wrong_exchange_rate
I haven't received the PIN yet.	get_physical_card
Why is it taking so long for my pending transaction to post as cleared?	pending_transfer
Can I get money out of any machine?	atm_support
i tried to transfer cryptocurrency into my account but was denied	beneficiary_not_allowed
I just realized I made the wrong transaction  yesterday. Would  you please make it correct?I need it by tomorrow.	cancel_transfer
Can I schedule future top ups?	automatic_top_up
i havent got my card	card_arrival
When will the money reach my  account?	transfer_timing
When will the transaction go through?	pending_card_payment
I have no idea why but my transfers keep getting declined. I have double checked all the recipient details several times already and they're definitely correct.	declined_transfer
My statement shows an extra fee - what is it?	extra_charge_on_statement
Are transfers not free? I didn't know I would be charged for transfers.	transfer_fee_charged
Do you offer free ATM withdrawals of ones hometown currency while on holiday?	wrong_exchange_rate_for_cash_withdrawal
How can I close my account, I don't want it.	terminate_account
Can you help me to quickly cancel a transaction I accidentally did to the wrong account?	cancel_transfer
How come my money hasn't shown up yet?	transfer_not_received_by_recipient
I'm not sure what is going on here. I've received payment back into my account  for an item I've already received, from about 2 weeks ago.	reverted_card_payment?
Can my friend send me money if it is not in US dollars?	receiving_money
How long is the delivery to the US?	card_delivery_estimate
I took out money, and didn't get all of it.	wrong_amount_of_cash_received
My friend wants to send me money, can she?	receiving_money
Do you accept cheques for top ups?	top_up_by_cash_or_cheque
Are there restrictions on disposable virtual cards?	disposable_card_limits
How do you figure out the exchange rate? Can you explain why I got less money than expected?	wrong_exchange_rate_for_cash_withdrawal
What is my top-up limit?	top_up_limits
What forms of ID should I use for verification?	verify_my_identity
im worried about fraud how do you protect my account	verify_my_identity
Can I get support?	country_support
So much time has gone by, the pending status shouldn't still be there shouldn't it?	pending_cash_withdrawal
I've checked multiple times to make sure the account number listed is the right one after attempting to make a transfer within the country the day before yesterday. The transfer is still not available so can you please find out what is going on?	transfer_not_received_by_recipient
Is there a reason why a recipient might not see my money transaction	transfer_not_received_by_recipient
Help me delete my account.  I am not satisfied with the service.	terminate_account
My account seems a bit off and getting weird charges.	transaction_charged_twice
how come when i asked for 100 it only gave me 20.00 in the app	wrong_amount_of_cash_received
who charged my card	transfer_fee_charged
Hello, Please look into this matter urgently. As i have lost my wallet and i can see one withdrawal, now i do not want to loose more money.	cash_withdrawal_not_recognised
What is the wait time for delivery to the US?	card_delivery_estimate
Are currency exchanges free?	exchange_charge
my identity hasn't been verified and i can't edit my details, what's next	edit_personal_details
why wont my american express work to add money	supported_cards_and_currencies
It's been some time ago that I placed an order and it just isn't coming. At this point just give me back my money because I'm not paying them.	request_refund
Hi, I used an ATM today to take money out of my account, but the amount it gave me is not the amount I requested. What should I do?	wrong_amount_of_cash_received
Is there a cash withdrawal fee? Because I just got charged?	cash_withdrawal_charge
Why was the price higher when I paid with my card?	card_payment_fee_charged
Is exchanging currencies one of your app services?	exchange_via_app
The balance does not appear to have updated.	balance_not_updated_after_bank_transfer
I really need to top-up my card today urgently but my card keeps getting declined!! Can you please resolve this problem or let me know if you have any alternatives	top_up_failed
What proof do you need for my identification?	unable_to_verify_identity
I had a duplicate card and bought something and it showed up twice. I canceled my card, how do I get my money back?	transaction_charged_twice
Why did I get charged extra?	card_payment_fee_charged
What are my limits on disposable cards?	disposable_card_limits
How can I fix this? The ATM gave me more cash than I'd asked for.	wrong_amount_of_cash_received
Are cards available in the EU?	country_support
What do I do if I cannot access the app?	lost_or_stolen_phone
I have done a transfer within the country the day before yesterday, but it's still not there yet. Can you please check what's going on with that, the account number definitely is the right one, I've checked that several times already.	transfer_not_received_by_recipient
I'm still waiting on my identity verification.	unable_to_verify_identity
I noticed a different charge while I was taking my money out.	cash_withdrawal_charge
I need to cancel a payment. Something i purchased a while ago still has not arrived and i'm not going to pay them if they won't send me what I purchased.	request_refund
How do I dispute a direct debit transaction?	direct_debit_payment_not_recognised
If I see a payment in the app that I don't recognize, what should I do?	card_payment_not_recognised
why would i be declined if i had money iin my account	declined_cash_withdrawal
My morning transaction needs to be canceled.	cancel_transfer
A receiver made me aware that they did not receive the full transfer that I made. The amount was showing to be a bit less. I now have to make a second transfer just to make up the difference. Can you reach out and let me know what's going on?	transfer_fee_charged
I need some money transferred ASAP, how long does the process take?	transfer_timing
The exchange rate used on your app is really bad. I'm considering closing my account because of it.	card_payment_wrong_exchange_rate
I need assistance to activate the card on my account.	activate_my_card
Are there businesses that don't accept this card?	card_acceptance
There is a pending payment on my account that is very strange. I don't remember making this and it won't go away. Can you help me figure this out?	extra_charge_on_statement
Do you offer a discount for those who perform frequent currency exchanges?	exchange_charge
Not living in same place, need to change details	edit_personal_details
Where will I get my card?	order_physical_card
Using Google Pay, can I top up?	apple_pay_or_google_pay
Someone stole my wallet a couple of hours ago now and they have taken money from my account. Is there any way that you can help so I won't lose any more of my money.	cash_withdrawal_not_recognised
what is the word?	direct_debit_payment_not_recognised
I hope you can help me. My account has been compromised from a different town that I haven't been to. Can you please place a hold on my account until I can make it to the bank?	cash_withdrawal_not_recognised
My card couldn't complete a transfer, why?	failed_transfer
I signed up, but don't have a PIN. Where can I find it?	get_physical_card
So, I was just charged for my recent ATM withdrawal and any withdrawal prior to this has been free. What is the issue here?	cash_withdrawal_charge
How long does a transfer from the United Kingdom take? I haven't seen it show up yet in my bank account and want to make sure I get the transfer.	balance_not_updated_after_bank_transfer
I just tried to top-up and now I'm getting an additional verification message, why?	verify_top_up
unhappy with service need to delete account	terminate_account
I made a transfer and the person I transferred the money to didn't receive the right amount? Why did this happen and how do I get the rest of the money to them?	transfer_fee_charged
My funds are not transferring to my bank. Why is this not working?	beneficiary_not_allowed
help me find where this money came from	verify_source_of_funds
Verifying the top-up seems like a hassle.	verify_top_up
What reasons could cause my top up to be reverted	top_up_reverted
Can I track the card you sent to me?	card_arrival
Is there a way to change my PIN without having to go to the bank?	change_pin
You shorted me money when I tried to make a withdrawal.	wrong_amount_of_cash_received
As far as courtries go which ones are supported?	country_support
Can you tell me exactly what fees I will expect to see in regards to your cards?	order_physical_card
I had to pay one pound more than the set price!	extra_charge_on_statement
Is there anywhere  In the  Eu  this card can not be delivered in	country_support
What types of fiduciary currencies are supported for tenure and exchange?	fiat_currency_support
Why was my top up reverted?	top_up_reverted
I just made an order and noticed an extra fee. Why have you charged me this without informing me?	card_payment_fee_charged
Why won't cash come out of the ATM?	declined_cash_withdrawal
Can you tell me how long it would take, to make a transfer from France? I made one 2 days ago and its not there yet.	balance_not_updated_after_bank_transfer
I seem to be having trouble with my Google Pay Top. Can you please help?	apple_pay_or_google_pay
Why was I charged a fee? I thought shopping was free?	card_payment_fee_charged
When will my money be in my account?	transfer_timing
Why does my transaction have an added fee?	extra_charge_on_statement
Can I set automatic top ups?	automatic_top_up
I need more physical cards than I have right now!	getting_spare_card
Hey, I tried to withdraw some cash earlier and it's saying it's pending? Will I be charged for this?	pending_cash_withdrawal
I need to cancel my card.  There are a few charges from a couple days ago that I didn't make.  Can I get credit for these charges?	card_payment_not_recognised
My new landlord says he hasn't received the rent payment that I transferred a couple days ago. I've already checked the account numbers and they are correct. Can you tell me what's going on with this transaction that the transfer isn't showing up on my landlord's end?	transfer_not_received_by_recipient
I am blocked now because I entered the wrong pin, need help.	pin_blocked
I paid two weeks ago and just got refunded	reverted_card_payment?
In a recent withdrawal I received less cash than I expected to receive.  Did someone make an error with the exchange rate?	wrong_exchange_rate_for_cash_withdrawal
When I add money to my international card do you charge a fee to do so?	top_up_by_card_charge
Hello. I looked at my account and see that a transaction I tried to do is pending, but I did not complete that transaction. When I was at the ATM, the machine declined my card. Can you make sure that transaction does not go through because I definitely did not receive the money.	pending_cash_withdrawal
Please tell me why I would have to pay a fee for a recent payment. Thanks.	card_payment_fee_charged
Why won't you let me name X as a beneficiary?	beneficiary_not_allowed
I deposited a cheque, but the balance hasn't changed yet.	balance_not_updated_after_cheque_or_cash_deposit
Will you assess me more fees if I top up with an international card?	top_up_by_card_charge
Hi, My card is getting declined during top-up. As it urgent, could you please resolve this issue, or guide me with other alternatives if any.	top_up_failed
I am seeing a direct debit I wasn't aware of.	direct_debit_payment_not_recognised
Do you guys accept cash? Because i deposited some this morning and I can't see it in my account.	balance_not_updated_after_cheque_or_cash_deposit
I am required to make several disposable cards every day.	disposable_card_limits
Why was there a fee for paying by card?	card_payment_fee_charged
Asked for $100 but only got $20. Why would this happen?	wrong_amount_of_cash_received
that fee should not be there, you charged my cash for an unnecessary thing.	cash_withdrawal_charge
I was refunded the money for something I bought already.	reverted_card_payment?
I am worried that too much time has gone by for a transfer to be completed.	transfer_not_received_by_recipient
I have been travelling overseas and I need to change my PIN. Can you tell me how this is done?	change_pin
In my app, a direct debit payment I didn't do shows in my app	direct_debit_payment_not_recognised
How do I go about getting an actual card?	order_physical_card
Does this program take SWIFT transfers?	top_up_by_bank_transfer_charge
I used my card to make a payment a while ago and its still pending, Why is it taking so long?	pending_card_payment
How long after I receive my statement can I dispute payments on it?	direct_debit_payment_not_recognised
My card is showing the same transaction over and over again.	transaction_charged_twice
My new card isn't in my app, how do I get it in there?	card_linking
A shop I go to didn't let me pay.	declined_card_payment
What happens if I deposit a cheque accidentally?	balance_not_updated_after_cheque_or_cash_deposit
Somebody made a withdrawal from my account for 500. I have my card so how can this be? Does somebody have a duplicate card or something? Help please.	cash_withdrawal_not_recognised
How much does it cost for additional cards?	getting_spare_card
How can people transfer money to me?	receiving_money
can i order cards on the app	order_physical_card
I made a transfer from France two days ago now but there hasn't made it there yet. Do international transfers take longer?	balance_not_updated_after_bank_transfer
What do I do to get ahold of my own card?	order_physical_card
Hello, there was an error while attempting top-up with my card this morning. I was able to use the card two days ago with no issues. Could you please assist?	top_up_failed
I would like to get both Mastercard and Visa card from you if that's possible.	visa_or_mastercard
My card payment is showing pending however this transaction was a couple of days ago. Is there a reason why it it still pending?	pending_card_payment
Your ATM pin can be changed at any VISA or MasterCard ATM with PIN services. Certain countries don't support ATM pin changes.	change_pin
I was charged extra or a hidden fee when I purchased something from you. What's the deal? I didn't authorize that charge.	extra_charge_on_statement
Will my card be a MasterCard or a Visa?	visa_or_mastercard
Please help me regarding a direct debit in the app that I don't recognize.	direct_debit_payment_not_recognised
Why did withdrawing money cost me extra?	cash_withdrawal_charge
My account shows I made a debit payment to someone that I can't recall and would like to find out who the payment was made to.	direct_debit_payment_not_recognised
I'm trying to activate the auto-top up function. Where is it?	automatic_top_up
I seem to be unable to make any transactions.	card_not_working
The money is still in my account even though I already paid -- I don't understand what happened.	reverted_card_payment?
how to track the card you sent	card_arrival
i didnt make these transactions, i think my card details might be stolen	compromised_card
The date my card expires is coming up	card_about_to_expire
Why was I charged for payments? You didn't warn me about additional fees.	card_payment_fee_charged
How do I order my card?	order_physical_card
I think my wallet fell out on the Tube today! I realized as soon as I got to my desk. How do I cut off the card?	lost_or_stolen_card
Why are all my card payments being declined?	declined_card_payment
I made an ATM withdrawal over the holiday and then later realized I was charged an exorbitant fee!  I never would've made this withdrawal if I'd known I'd be charged so much.	wrong_exchange_rate_for_cash_withdrawal
How can I periodically check the delivery of the card you sent?	card_arrival
Why was my request for cash declined?	declined_cash_withdrawal
I transferred money to another country several days ago, but my transaction is still pending. i have checked that the accounts are keyed in correctly. what sees to be the problem?	pending_transfer
I did not set up a direct debit I have	direct_debit_payment_not_recognised
How's the exchange rate looking right now?	exchange_rate
How long does it take for the card to come?	card_delivery_estimate
In regards to the PIN of the card?	get_physical_card
How do I close my account, since I'm dissatisfied?	terminate_account
Are there charges for cash withdrawals?	cash_withdrawal_charge
The terminal I paid at wouldn't take my card. Is something wrong?	contactless_not_working
My phone is missing.	lost_or_stolen_phone
Physical cards are what I need more of	getting_spare_card
I made a transfer and the receiver did not get the right amount its lesser than what it should be,Now I have to transfer more money to make up for the missing amount . Can you please help me about this, what should be done	transfer_fee_charged
I have done a transfer within the country a couple days ago, but it's still not there yet. Can you please check what's going on with that, the account number definitely is the right one, I've checked that several times already.	transfer_not_received_by_recipient
I deposited a check yesterday and im not seeing it posted yet in my account. why is that? can you look into it?	balance_not_updated_after_cheque_or_cash_deposit
Are there directions to get a new passcode if I forgot mine?	passcode_forgotten
I see a direct debit transaction in my history that I did not set up.	direct_debit_payment_not_recognised
Does the package with my card have tracking?	card_arrival
