text	label
Hello - I'm on the app and trying to purchase crypto. It's not going through. What am I doing wrong?	beneficiary_not_allowed
Do top-up limits exist?	top_up_limits
i have a pending top-up	pending_top_up
What card or currency can I use to pay?	supported_cards_and_currencies
I deposited some money, but the balance has not changed.	balance_not_updated_after_cheque_or_cash_deposit
Can I use my account before my Identity verification has passed?	why_verify_identity
I got billed an extra pound!	extra_charge_on_statement
How long should it take for my new card to arrive in them mail? What should I do if I never receive it?	card_arrival
What are the currency types that I can keep money in.	fiat_currency_support
Please help me, there is a transaction in the incorrect account.	cancel_transfer
Hello, I am buying a flat and need the inital payment for the mortgage to go through. It keeps showing up as error, what is going on? Can you please help me make this transfer?	failed_transfer
Some cash was missing at ATM.	wrong_amount_of_cash_received
How long does it take to verify a person's identity?	unable_to_verify_identity
Can my PIN changed remotely without visiting a bank?	change_pin
Would I be charged any fees if I added money to my account using an international card?	top_up_by_card_charge
How can a payment be declined	declined_card_payment
I got an unexpected charge on my transfers. How can I correct this?	transfer_fee_charged
What currences are available for exchange?	exchange_via_app
There was an extra charge when I used my card	card_payment_fee_charged
Please tell me where I can update my details since I moved.	edit_personal_details
I seem to have a problem here, I bought something about a 2 weeks ago and just now received the payment back into my account and I've already received the item. Can you tell me what is going on here?	reverted_card_payment?
My top up did not show up as shown and my money has disappeared, can you help me fix this glitch problem?	top_up_reverted
Lost password	passcode_forgotten
need help with google pay top up	apple_pay_or_google_pay
How can I convert currencies?	exchange_via_app
If I need more than cards will I have to pay a fee to receive them?	getting_spare_card
Whats the reason for my payment being declined? It looked like everything went through ok and my account was good.	declined_card_payment
Please double check my card - withdrawal was working fine so far, but this morning on the way to work it suddenly got declined!	declined_cash_withdrawal
Do you accept cheques for top-up?	top_up_by_cash_or_cheque
How long do transfers typically take? Is there a way of speeding the process up? My friend needs the money I sent her desperately.	transfer_not_received_by_recipient
What's the process for topping up by card?	topping_up_by_card
What are the restrictions on the virtual cards?	disposable_card_limits
When traveling, is it possible for it to add money at specific time intervals?	automatic_top_up
Why wasn't my top-up accepted and where did that money go? At first it said it was confirmed but now I can't find it.	top_up_reverted
I could not get a top-up to work, why?	top_up_failed
Verifying top-up cards necessary?	verify_top_up
what was the $1 fee i got	extra_charge_on_statement
I made a deposit in the ATM and it has not cleared	pending_cash_withdrawal
How do I troubleshoot my contactless?	contactless_not_working
My beneficiary didn't receive my transfer	beneficiary_not_allowed
Give me a refund now!! I am still waiting.	Refund_not_showing_up
How to receive the actual card	order_physical_card
Can you tell me the names of the fiat currencies that I can use at your institution?	fiat_currency_support
I deposited cash into my account, why do I not see it?	balance_not_updated_after_cheque_or_cash_deposit
I don't understand why I'm being charged for using my card.	card_payment_fee_charged
I can not find my refund.	Refund_not_showing_up
I NEED HELP WITH MY CARD!!!!! please. It keeps getting declined when I try to use it. I have tried a few times to use it and it keeps getting rejected. I have no idea why.	declined_card_payment
my top up isnt there yet where do i find it	topping_up_by_card
My transfer was wrong, are you able to stop it before it goes through please?	cancel_transfer
Do I need to do anything? My phone was stolen yesterday.	lost_or_stolen_phone
I'm trying to move money from my account to elsewhere, but it's giving me an error message.	declined_transfer
I really need to top-up my card today urgently but my card keeps getting declined!! Can you please resolve this problem or try an alternative	top_up_failed
i have tried everything to complete a transfer but can't, what should i do next	declined_transfer
I heard that you support more than one type of fiat currency, would you tell me which ones please?	fiat_currency_support
Should my top-up be completed by now?	pending_top_up
What do I do if I got the wrong amount at the ATM?	wrong_amount_of_cash_received
What is the refund procedure?	request_refund
I used the ATM to get money out and did not realize I would be charged as much as I was or I would not have done that!	wrong_exchange_rate_for_cash_withdrawal
Could I raise a dispute for a large payment that i found out was not done by me in my couple of last statements? I am aware its delayed now. Please help me out.	direct_debit_payment_not_recognised
How long do tranfers from a UK account usuallt take for you? I just made a transfer and nothing shows up, so just wondering if things went ok	balance_not_updated_after_bank_transfer
Transfer was declined, could not complete request.	declined_transfer
Does the PIN come under separate cover?	get_physical_card
I made a payment and it appears it is showing twice	transaction_charged_twice
How can I check how much free spending I have left? I have some big purchases coming up and want to know where I can look for any info.	card_payment_fee_charged
Help! I've forgot my app passcode!	passcode_forgotten
Card payment was declined, do you know why?	declined_card_payment
Hi there, earlier today I tried to take money out of an ATM machine, and something wasn't working.  I didn't actually receive the money, but I just checked and it says that the transaction is still pending.  Can you tell me what's going on here? Am I still being charged for the withdrawal even though I didn't end up getting any money?	pending_cash_withdrawal
How long before a check I send clears?	top_up_by_cash_or_cheque
What's going on with my balance? Shouldn't it be a bit higher since I deposited a cheque a day ago?	balance_not_updated_after_cheque_or_cash_deposit
I have made 5 attempts to make a very standard survey, yet I can't get it to work. What is the problem? Is there an issue related to your system?	failed_transfer
I need to freeze my card as soon as possible. I just checked my account and saw that there have been several payments that I don't recognize over the course of a few days. Can we investigate and get my money back?	card_payment_not_recognised
I tried to get gas but my money was gone!	topping_up_by_card
The app is showing a payment I never made.	card_payment_not_recognised
I can't see my refund in my history.	Refund_not_showing_up
Are cards delivered to my location?	order_physical_card
what to do about stolen phone	lost_or_stolen_phone
My payment shows that it is pending will I be charged more money?	pending_transfer
What is the greatest number of times that I can top-up?	top_up_limits
How long should it take for my top-up to finish? I've been waiting a while.	pending_top_up
I bought something online a week ago and i never got it in the mail.Can I just get my money back now I don't want to keep waiting on something that isn't going to show up.	request_refund
How much does it cost to get more cards?	getting_spare_card
What is the delivery time to the US?	card_delivery_estimate
Hello, I believe there has been a mistake made on the exchange rate for my card. Could you please check the official interbank exchange rate for me?	card_payment_wrong_exchange_rate
From which age can my kids use your service?	age_limit
I have received my American express in apple play, looks like top up has an issue, please help?	apple_pay_or_google_pay
I need to dispute a direct debit.	direct_debit_payment_not_recognised
Why does top-up require verification?	verify_top_up
The exchange rate you are using is really bad.This can't be the official interbank exchange rate.	card_payment_wrong_exchange_rate
Can I get information on the identity checks?	verify_my_identity
There's a payment that isn't mine on my app	card_payment_not_recognised
On the card that is coming, what's the tracking info?	card_arrival
Bank transfer to account did not show up, please help?	balance_not_updated_after_bank_transfer
My account was charged a debit payment I don't recognize.	direct_debit_payment_not_recognised
The cash I wanted wasn't there.	wrong_amount_of_cash_received
I exchange my currency quite a bit.  Do I get an exchange price break?	exchange_charge
where can i deposit a check	top_up_by_cash_or_cheque
I just took some cash out of a cash machine in Heathrow airport because I wanted to buy some new sunglasses for my holiday but you've added a fee to the withdrawal, what is this?	cash_withdrawal_charge
One of my payments was doubled	transaction_charged_twice
My card is showing multiple charges for the same items on my recent statement. I was wondering what actions of needed to take to fix this issue	transaction_charged_twice
I need to verify a payment to my new landlord. I transferred the first rent payment a few days ago. While it shows on my side, the landlord is saying he hasn't received it yet. Can you verify that it has processed?	transfer_not_received_by_recipient
Why was I charged an additional $1?	extra_charge_on_statement
It is common for an international transfer to take 2 days or longer? I made a transfer from France 2 days ago and I have not seen it yet.	balance_not_updated_after_bank_transfer
I used the wrong account.	cancel_transfer
What could the reason be that my payment card was declined?	declined_card_payment
There has been a charge pending on my account statement that I can't figue out it's for a dollar.	extra_charge_on_statement
I was overcharged a pound.	extra_charge_on_statement
I put some money in my account the other day and it's not gone in yet, can you help with this?	balance_not_updated_after_cheque_or_cash_deposit
I made the incorrect payment for my rent yesterday and this needs to be fixed by no later than tomorrow. How can you help?	cancel_transfer
I placed a cheque but the funds aren't there	balance_not_updated_after_cheque_or_cash_deposit
I've been waiting since Friday, where is my money?	transfer_not_received_by_recipient
WHAT IS THE MAIN REASON OF THIS PROBLEM	card_not_working
I got double charged from something, what can I do?	transaction_charged_twice
There is something wrong with my card. Tried to use it a few times today in different places and it just didn't work. The transactions I tried to make were really small so not sure what's going on	card_not_working
I am perplexed. Why is it that I received an extremely wrong rate when I tried to use an ATM using a foreign currency?	wrong_exchange_rate_for_cash_withdrawal
Please explain why my top-up hasn't been processed yet?	pending_top_up
I wasn't charged the correct exchange rate for an item I purchased.	card_payment_wrong_exchange_rate
Why am I seeing a direct debit thats not mine?	direct_debit_payment_not_recognised
when i travel can it top up automatically	automatic_top_up
What currencies are supported?	fiat_currency_support
I checked on google and the exchange rate you are using is really bad. Can you update it?	card_payment_wrong_exchange_rate
I want to top up from my Apple Watch, can I?	apple_pay_or_google_pay
I've been waiting ages and my PIN hasn't gotten here.	get_physical_card
Why are you charging for cash withdrawals? I went to withdraw some money earlier today after getting my groceries, and it appears there is a fee that wasn't there before	cash_withdrawal_charge
I purchased something overseas and the incorrect exchange rate was applied.	card_payment_wrong_exchange_rate
I'm going on a trip soon and I needed to convert my Russian ruble to UK pounds, but when I did, your company charged me above the exchange rate. Did you mess up my transaction?	card_payment_wrong_exchange_rate
Hi i received an error message informing me about the transaction failure. I have done the money transfer before and it never failed. Please let me know what is the issue this time.	beneficiary_not_allowed
I just checked my statement and saw a $1 charge, why is it there?	extra_charge_on_statement
Is there a way to track my card?	card_arrival
I'm suddenly getting an error while attempting a transfer that it isn't possible. Why? I've done it before.	beneficiary_not_allowed
Supported countries	country_support
What are these disposable cards meant for?	get_disposable_virtual_card
Do you have to be in the UK to get a card?	country_support
"""I received a """"declined"""" message when doing a transfer"""	declined_transfer
How much does it cost to make transfers?	top_up_by_bank_transfer_charge
My card has an expiration date, will you send a new one automatically?	card_about_to_expire
My credit card seems to have been declined for top up. Why is it not going through? Can you tell me what's going on?	top_up_failed
How much does each transfer cost?	top_up_by_bank_transfer_charge
Can you give me info about what to do when my card expires?	card_about_to_expire
I entered the pin incorrectly too many times and now it is blocked. Can you help?	pin_blocked
Where'd the rest of my cash go from the ATM	wrong_amount_of_cash_received
My card keeps getting declined when I try to use it.  I would like to top-up, but it is not going though.	top_up_failed
I'm going on holiday to France for 6 weeks with my family and the cat, Fluffy.  I just purchased €10,000 from a currency exchange to ensure we don't run short but there appears to be a fee.  What is this for?	card_payment_fee_charged
What are the auto-top up policies?	automatic_top_up
I'd lke my card reactivated, I was thinking it was misplaced but I discovered when I woke up that I had left it in my coat.	card_linking
I just got a card, how can I add it to the app?	card_linking
I got my card now, how do I make it show up in the app?	card_linking
Is it possible to use an ATM when I am not in the country and make a withdraw with out extra fees?	wrong_exchange_rate_for_cash_withdrawal
How do I fill out the identity check?	verify_my_identity
I think the currency exchange that's been applied is wrong.	card_payment_wrong_exchange_rate
is it possible to cancel transactions?	cancel_transfer
why wouldnt the atm give me money	declined_cash_withdrawal
I can't find the PIN.	get_physical_card
what happened to the money after i put in the wrong info and it got declined	topping_up_by_card
Why does my statement have an extra fee?	extra_charge_on_statement
I didn't mean to do the transfer, is there any way to cancel it?	cancel_transfer
I am having issues using contactless payments, could my card be damaged?	contactless_not_working
I need an actual card that I can hold in my hand, how do I do that?	order_physical_card
What is going on? I have checked over and over and the details of my account are right. Why is my transfer still pending? It's 2018 not 1818. Transfering money to another country can't be that hard.	pending_transfer
In my app, a direct debit payment that I didn't do shows up.	direct_debit_payment_not_recognised
Just today there was a purchase on my card that wasn't done by me. Can this be reversed and my card be frozen? I can't have this continue!	card_payment_not_recognised
A refund is taking too long.	Refund_not_showing_up
How long do cheques take to post to your account?	balance_not_updated_after_cheque_or_cash_deposit
What happens if a merchant doesn't accept  you payment?	reverted_card_payment?
I was issued a card about a week ago. why hasn't it come in yet?	card_arrival
are multiple currencies acceptable?	fiat_currency_support
My contactless is non-functional.	contactless_not_working
Are there any express fees if i want my new card faster?	card_about_to_expire
I just made a transfer from France 2 days ago. It has not yet reached my bank. Is it possible it takes longer because it was an international transfer?	balance_not_updated_after_bank_transfer
Hi - I have made a transaction to my new landlord but unfortunately it shows on my end but not on the landlord's end. The numbers are correct. Can you confirm when that will go through?	transfer_not_received_by_recipient
Are cards issued to people living in the US?	country_support
Is there any way for you to find my card?	lost_or_stolen_card
Has my account been frozen?  I tried to use my card but the ATM would not dispense cash.	declined_cash_withdrawal
Is it possible to get both Mastercard and Visa card from you?	visa_or_mastercard
How can I top up my card with another card?	supported_cards_and_currencies
can i add funds  with a card from the united states	supported_cards_and_currencies
What documentation do you accept for the identity check?	verify_my_identity
i withdrew cash and dont see it reflected on the balance	pending_cash_withdrawal
Why was there an additional fee on the payment I just made? I don't usually have additional fees applied to my payments.	card_payment_fee_charged
If I get another card, what kind of fees am I looking at?	getting_spare_card
What do you require for identification verification?	verify_my_identity
Is this open to residents of all countries?	country_support
Was my transaction reverted with my card?	reverted_card_payment?
What happened to the transfer I did?	balance_not_updated_after_bank_transfer
i transfered and yet it is still pending	pending_transfer
Is it possible to go ahead and log in, although I have not been confirmed yet?	why_verify_identity
Where can I update my pin number?	change_pin
Hi, I draw out some money from the ATM today. The ATM has given me wrong amount and the application is displaying more amount than i withdraw.	wrong_amount_of_cash_received
I just recently got a new beach condo in Bora Bora, and to furnish it I used this account a lot from overseas. It's upsetting, being a long-time customer of yours, that I saw extra fees on my account from my currency transfer. Is this what I should expect from you in the future?	transfer_fee_charged
Do I have a Visa card as an option?	visa_or_mastercard
Is American Express accepted?	supported_cards_and_currencies
I'm on holiday and I noticed a different amount for exchange rate.  Can you explain?	card_payment_wrong_exchange_rate
Can cash be used in physical locations to top up?	top_up_by_cash_or_cheque
Why did I get charged one pound seemingly randomly?	extra_charge_on_statement
I'm not sure what to do about the PIN, because I don't have one yet.	get_physical_card
Hello-Can you please help me get a refund from this merchant?  I ordered a product and would like to return it. I have been unsuccessful in getting the merchant to return my request for the past several days.  I understand it can take up to 45 days to process the dispute and issue a refund, however, if this can be expedited faster it would be very helpful to me.	request_refund
Will the system automatically top up itself?	automatic_top_up
MY transfer has still not appeared.	balance_not_updated_after_bank_transfer
Why doesn't it work when I use American Express to try to add money to my account?	supported_cards_and_currencies
Estimated time arrival for transfers?	transfer_timing
I requested a refund from Next because the dress I purchased had three arm holes. They said they sent the refund last Wednesday which is nearly a week ago and I still don't have it.  Why not?	Refund_not_showing_up
Can I change my PIN at a nearby ATM when in Spain? I think someone saw my PIN and I need to change it but am on vacation.	change_pin
are there age requirements	age_limit
Why is my transfer taking so long. I thought it was supposed to only take 1 day if I made a transfer to someone. Can you wee what went wrong?	transfer_not_received_by_recipient
Is my country's currency supported by your system?	fiat_currency_support
My card is stuck in an ATM machine, how do I get it back quickly?	card_swallowed
Can I use my account although my identity verification has yet to pass?	why_verify_identity
I have been waiting for my card payment to be moved from pending status for an unusually long time.  What is going on here and do you have an idea of when I can expect it to go through?	pending_card_payment
I need mastercard as well as visa	visa_or_mastercard
A receiver let me know that they didn't receive the full transfer I completed and that it was actually a bit less than what I sent. At this point I have to make another transfer to make up for the amount missing. Can you please follow up with what's going  on here?	transfer_fee_charged
Is there a reason why top-up needs verifying?	verify_top_up
Next time maybe let people know that buying things from another country costs extra. I used my card to purchase an item from another country and I was charged for the item and also an extra fee it looks like. I wasnt aware of this and I think I should get a refund.	transfer_fee_charged
I need multiple cards per day, and they all have to be disposable.	disposable_card_limits
Someone has access to my card info.  I still have the card, but someone just withdrew cash.  How do I get this corrected/stopped?!	cash_withdrawal_not_recognised
Am I able to add money into my account using my American Express?	supported_cards_and_currencies
Can I use a different bank ATM than my own?	atm_support
I requested for a top-up but it has not reflected	top_up_failed
What am I supposed to do if the funds haven't show up from a transfer completed this morning?	pending_transfer
Please tell me how to edit my personal details.	edit_personal_details
Over the holiday I withdrew cash from the ATM and it seems that I was severely overcharged. Had I known that I would be charged those fees, I would not have used the ATM!	wrong_exchange_rate_for_cash_withdrawal
Which fiat currencies are compatible for exchange and holding?	fiat_currency_support
I am angry that I got charged for using my card.	card_payment_fee_charged
Why does my statement show various transaction times?	transaction_charged_twice
I need my PIN, where is it?	get_physical_card
My card payment is just showing up as pending since forever, what's going on with that, it should be going through at some point?	pending_card_payment
I forgot my code	passcode_forgotten
Are there ways for other people to send me money?	receiving_money
What is the time frame that transfers normally take from a UK account? I just completed a transfer and nothing shows up. I need to know if everything is alright.	balance_not_updated_after_bank_transfer
My card won't let me withdraw money.	declined_cash_withdrawal
As advised by you, i requested seller to refund my money. A week has passed but i haven't got any update from seller. Please track the refund with the seller.	Refund_not_showing_up
Why am I being charged a hidden fee?	card_payment_fee_charged
why did i only get 20.00	wrong_amount_of_cash_received
How do I get a refund for an unauthorized direct debit payment?	direct_debit_payment_not_recognised
Are bank transfers immediate?	balance_not_updated_after_bank_transfer
I'm really upset because I made a typo during a transfer and now I've sent money to the wrong account.  I can't fix this with the app.  Please help me immediately!	cancel_transfer
I just transferred my friend money, but she hasn't received it yet, and it's been a few hours. Can you tell me when to expect it to go through?	transfer_not_received_by_recipient
"""I made a transfer and according to the receiver """"they haven't received the right amount"""" Its lesser than it should be.Now I have to transfer more money to make up for the missing amount . Can you please help me about this,what should be done"""	transfer_fee_charged
Help Me!  I lost my card.  What should I do?	lost_or_stolen_card
Could I please cancel my transfer, I paid it into the wrong account. I need to pay it into the right account by tomorrow.	cancel_transfer
How long is a top up supposed to be pending, because an hour is too long! Can you fix this to go through?	pending_top_up
should i contact customer support if i can't edit details	edit_personal_details
How many active cards can I have?	getting_spare_card
Which locations can I withdraw money from?	atm_support
No Visa please. I want to continue with Mastercard.	visa_or_mastercard
I lost my card n need a new one.	lost_or_stolen_card
I have one of your cards, but I don't know how to link it.	card_linking
What documentation is needed for the identity check?	verify_my_identity
I am unable to activate my card, it won't let me.	activate_my_card
What happens when my card expires?	card_about_to_expire
I'm interested in using fiat currencies, which do you support?	fiat_currency_support
lost card found, want to put it back in app	card_linking
My identity can't be verified.	unable_to_verify_identity
An overseas cash transfer did not work correctly	wrong_exchange_rate_for_cash_withdrawal
A direct debit payment that I didn't authorise shows up in my app.	direct_debit_payment_not_recognised
Is there a location where I can change my PIN?	change_pin
I don't recognize some transactions.  Is someone else using it?	compromised_card
Where does the exchange rate stand right now?	exchange_rate
This past holiday I made a withdraw at the ATM machine, and it seems I've been charged too much.	wrong_exchange_rate_for_cash_withdrawal
What are the steps to activate the card, as it does not seem to work?	activate_my_card
Why haven't I gotten a virtual card yet?	getting_virtual_card
I submitted a transaction but it was for the incorrect account.	cancel_transfer
