text	label
I'm checking the app and I see a payment that's not mine.	card_payment_not_recognised
I am quite aggravated that I ordered online almost a month ago and I never got my package and I paid for it. I would really appreciate it if I could get a full refund back now.	request_refund
My money transfer hasn't appeared yet.	pending_transfer
It looks like a payment I've made hasn't made it through yet.	pending_card_payment
Why hasn't payment gone through yet?	pending_card_payment
Can you tell me why the transfer isn't showing up on my account?	balance_not_updated_after_bank_transfer
I don't want to use this method to identify myself.	why_verify_identity
It is extremely important that I cancel the transfer I made yesterday and put the money into a different account.  Is this possible?	cancel_transfer
For a week now, I have tried to use my card and it is still not working.	card_not_working
Won't let me top my card up!! Who can get it sorted out for me? It's urgent! How do I find out what the problem is with my card and how else to top it up?	top_up_failed
I tried to withdraw 50 pounds but it only gave me 30. Where is the rest of my money?	wrong_amount_of_cash_received
I have been charged to much for the object I bought when abroad, the exchange rate seems to be wrong.	card_payment_wrong_exchange_rate
Why do you keep declining my payment?I tried several times already with this card and it is just not working.	declined_card_payment
DO you know the reason for the identity check?	why_verify_identity
What needs to be provided for identity verification?	verify_my_identity
My credit card was declined for top-up. Can you see if there is enough funds in my account?	top_up_failed
stop the transaction	cancel_transfer
My ID verification hasn't gone through yet, but can I use my account anyway?	why_verify_identity
Where is my credit card that was to be mailed?	card_arrival
Can you find out why my credit card didn't process payment? It was declined for top up so what's the deal?	top_up_failed
I'm panicking!  I lost my card!  Help!	lost_or_stolen_card
My top-up does not seem to have worked, what  went wrong?	top_up_failed
This exchange rate you use is awful! Please tell me this is a mistake and not the official interbank exchange rate!	card_payment_wrong_exchange_rate
What happens if my card expires?	card_about_to_expire
I used my card to top up, but now I don't see the money in my account.	topping_up_by_card
I have a trip coming up and want to add money automatically.	automatic_top_up
I'm trying to make a bank transfer but It's not going through. Could there not be enough funds to transfer or something? Have I done it too many times?	failed_transfer
Can I use this app for any currency?	supported_cards_and_currencies
What do I need to bring for identification?	unable_to_verify_identity
Could I get a mastercard if that's reasonable?	visa_or_mastercard
What transfer methods do you accept?	transfer_into_account
I tried activating my card and it doesn't work how do I solve this problem?	activate_my_card
What's the process of changing from GBP to AUD?	exchange_via_app
Are these cards available in europe?	country_support
My address needs to be changed.	edit_personal_details
I need to freeze my card. There are charges on there that i did not authorize. They've been coming out for a couple of days. Can i get this money back?	card_payment_not_recognised
How can I get money in my home currency while I'm traveling internationally? I wanted to take it out of a local ATM but am worried that I will get charged extra fees.	wrong_exchange_rate_for_cash_withdrawal
Do you charge a fee on currency exchange?	exchange_charge
Help! I lost my card!	lost_or_stolen_card
My account is devoid of funds. Am I permitted to submit additional money via bank transfer?	transfer_into_account
if i found a lost card can i put it back in app	card_linking
Errors keep showing up every time I try to make this transfer and I am on a time crunch,  could you please help.	failed_transfer
How can I tell if there will be a fee added to my payment or not?	card_payment_fee_charged
I tempted to get some money out of the machine earlier and it did not work.Looking now, the transaction actually shows to still be in progress. I would certainly appreciate someone look into this and let me know what's going on. I definitely do not want to be charged for money I never received.	pending_cash_withdrawal
My top-up was supposed to be done, but now the money is gone! Is there a glitch in your system?	top_up_reverted
Is there a charge for getting my money?	top_up_by_bank_transfer_charge
Is there a fee to top up by bank transfers?	top_up_by_bank_transfer_charge
What are the reasons a beneficiary would be denied?	beneficiary_not_allowed
I think I have an extra transfer charge.	transfer_fee_charged
this verifying the top up is annoying	verify_top_up
I believe i was charged for making a withdrawal after i went grocery shopping. Are you guys charging for this now?	cash_withdrawal_charge
Was I charged extra for using my card?	card_payment_fee_charged
What's going on? I was just recently charged for an ATM withdrawal. I've never seen this charge before and before it's always been free.	cash_withdrawal_charge
I do not see the money I transferred into this account	balance_not_updated_after_bank_transfer
I need assistance finding out why I am unable to top-up my card, it keeps getting refused.  It is extremely imperative I get this resolved quickly.	top_up_failed
Help! I'm missing money, I deposited a cheque but its not showing on my balance.	balance_not_updated_after_cheque_or_cash_deposit
Is there always a charge when withdrawing money?	cash_withdrawal_charge
I tried to buy something online but my funds were transferred back to my account. What is happening?	reverted_card_payment?
I saw a fee on my receipt from withdrawing money while shopping earlier.  Is there supposed to be a fee for this type of transaction?	cash_withdrawal_charge
My phone was stolen, what can I do?	lost_or_stolen_phone
My card's expiring a month from now, should I place an order for the new card?	card_about_to_expire
My withdrawals were going smooth until I got declined today. What is going on?	declined_cash_withdrawal
After making a payment with my card it doesn't seem to have worked. It's just showing to be pending. When will this actually be going through?	pending_card_payment
i need to add express delivery if that's an option	card_delivery_estimate
Are the delivery days flexible?  My schedule only allows me to be a available on specific dates.	card_delivery_estimate
I put money in my account a week ago but its still not there?? What happened to my money?	balance_not_updated_after_cheque_or_cash_deposit
Hurry and refund me, I am waiting	Refund_not_showing_up
My balance was not updated with my checque or cash deposit.	balance_not_updated_after_cheque_or_cash_deposit
There is a direct debit patentp that I haven't authorized.	direct_debit_payment_not_recognised
I've made a transfer from France two days ago but I was wondering if international transfers take longer to arrive because it hasn't made it yet.	balance_not_updated_after_bank_transfer
Given a choice, I'd rather have Mastercard.	visa_or_mastercard
I am very dissatisfied with the services that you are providing.  I want to cancel my account.	terminate_account
I'd like to get a Visa card, please.	visa_or_mastercard
Please explain the charge of 1L in error.  I have purchased nothing in this amount.	extra_charge_on_statement
If I live outside of the UK am I still eligible for a card?	country_support
Can the card was sen to me be tracked?	card_arrival
Explain the extra ATM fees.	cash_withdrawal_charge
Contactless payments need to be enabled for my card.	contactless_not_working
Is it possible to track the card you sent me?	card_arrival
How long is delivery to the US?	card_delivery_estimate
My cash withdrawl has the wrong rate of exchange.	wrong_exchange_rate_for_cash_withdrawal
My app shows a direct debit that isn't mine.	direct_debit_payment_not_recognised
Tell me how to top up my account using bank transfer.	transfer_into_account
Why am I being charged more on exchange with things I bought abroad?	card_payment_wrong_exchange_rate
Does the app allow for exchanges between currencies?	exchange_via_app
I found my card that I thought I had lost, I need to reactive it, please help.	card_linking
Help me. My transfer was declined. How could this happen?	declined_transfer
Change my pin?	change_pin
Can you assist on apple watch top ups?	apple_pay_or_google_pay
Someone that I had to send money to told me that they didn't receive the full amount I sent them - can you look into this?	transfer_fee_charged
Can someone in the US have a card?	country_support
I purchased something about one to two weeks ago but for some reason the payment was returned to my account today even though I've already received one of the items. Can you tell me what's going on?	reverted_card_payment?
Transaction showing up many times.	transaction_charged_twice
I have a question about ATM transactions. Can I take money out of an ATM when I'm traveling abroad? And, can I get the money in my home currancy?	wrong_exchange_rate_for_cash_withdrawal
Is there a problem with your system being down or something? I have already tried 5 times to issue a standard transfer but I'm getting nowhere.	failed_transfer
I tried doing an in country transfer earlier this week. I thought it would be there by now but I still don't see the money. Can you check the status on my transfer?	transfer_not_received_by_recipient
Why am I being charged to make cash withdrawals? I thought they were supposed to be free!	cash_withdrawal_charge
I wanted to purchase something online but the payment was returned back to me. This has been going on for a couple of weeks. Please tell me what is going on here?	reverted_card_payment?
i am not a premium customer but i want a virtual card, how do i get it	disposable_card_limits
I am still waiting to find out the status of my refund. I have made previous attempts to find out what the status is to no avail. Will you please look into this for me?	Refund_not_showing_up
I just realized I made the wrong transaction yesterday. Would  you please make it correct?I need it by tomorrow Please.	cancel_transfer
My friend says he hasn't received my transaction	transfer_not_received_by_recipient
Please help me, its urgent. Someone has withdrawn money from my account as few hours before my wallet has been. Now i want to stop withdrawal of more money.	cash_withdrawal_not_recognised
Hello, I didn't receive the right amount on my ATM transaction,  the app shows the correct amount how can we fix this	wrong_amount_of_cash_received
Is there a fee for sending additional cards?	getting_spare_card
I am not happy with your service and request that my account be terminated!	terminate_account
Can I get money in my home currency at some ATM? I'm on holiday and am a bit concerned because I don't have any cash with me, it is possible to withdraw here already without any additional cost?	wrong_exchange_rate_for_cash_withdrawal
Why does it still charge me even though I was unable to withdraw money from the ATM?	pending_cash_withdrawal
My withdrawal is pending, why?	pending_cash_withdrawal
pending transaction?	pending_card_payment
I'm still waiting for the top-up!	pending_top_up
Do you have any card fees if I want to add money using an international card?	top_up_by_card_charge
There is a strange 1£ charge that appears as pending on my statement. What's the cause for that? I haven't purchased anything for a pound.	extra_charge_on_statement
How do you Top Up on the apple watch?	apple_pay_or_google_pay
Can you please advise if there is something wrong with my card? I have had multiple rejections and do not know the reason. Thanks!	declined_card_payment
Will I see fees from adding money with an international card?	top_up_by_card_charge
I used the wrong account number!	cancel_transfer
Are you able to guide me to my card's location?	lost_or_stolen_card
How long does EU transfer take? I bought something online a couple days ago , sent the money immediately online but the seller says it is still not there yet	pending_transfer
i cant seem to activate card	activate_my_card
Who charged me a fee for paying by card?	card_payment_fee_charged
If you to to account, hit activate, and follow the instructions, you can activate it in just a few seconds.	activate_my_card
Where can I find out the fee structure for my account? I have been charged fees for some transactions, but not for other ones. I can't find a pattern in these fees.	card_payment_fee_charged
Why am I being charged fees on some transactions but not on others? What am I missing here? I cannot find where to see the fee structure on my account. Help!	card_payment_fee_charged
Are extra charges added for sending out additional cards?	getting_spare_card
Help me terminate and close my account.	terminate_account
It is urgency. Please freeze my card now. As someone in some odd remote town has withdrawn some money by using my card. As i did not withdraw any money.	cash_withdrawal_not_recognised
I see a direct debit charge that I did not approve	direct_debit_payment_not_recognised
Can I already use my account although the identity verification has not passed yet?	why_verify_identity
I checked my statement and saw a charge of one pound, where is this charge coming from?	extra_charge_on_statement
i need a refund right away but the funds aren't available in my account	Refund_not_showing_up
Is there a charge for using transfers for top ups?	top_up_by_bank_transfer_charge
How much would an extra card cost?	getting_spare_card
What locations can I get money from?	atm_support
Every ATM I visit is rejecting my card and I don't know why. There should be money on it. Can you check it to see if something is wrong or if I'm doing something wrong?	declined_cash_withdrawal
I think someone may have cloned my card or something.  My card isn't lost but I just saw a charge of $500 cash withdraw.  Can you help me?	cash_withdrawal_not_recognised
The first payment I attempted for my card at the store earlier did not process so I had to make a second attempt. The second time it worked. It now appears I was charged twice. After looking at the app I see a pending charge. Please remove the pending amount because it is clearly not accurate and was declined.	transaction_charged_twice
I am locked out from entering my pin.	pin_blocked
I paid my rent into the wrong account, could you please pay it into the right account, it needs to be done by tomorrow.	cancel_transfer
How much for an actual card?	order_physical_card
Do you issue cards for someone living in the US?	country_support
I don't remember my password	passcode_forgotten
My top-up seems to be pending for a long time?	pending_top_up
Does it cost me anything to top up my account via bank transfer?	top_up_by_bank_transfer_charge
Why am I missing my refund	Refund_not_showing_up
always exchanging currencies, do you offer a discount?	exchange_charge
Transfer declined.	declined_transfer
Are there any limits to using disposable virtual cards?	disposable_card_limits
Will my employer be able to pay me with this service	receiving_money
Hi , I just came to know I made the wrong transaction  yesterday. Would  you please make it correct?I need it by tomorrow.	cancel_transfer
Cancel Transaction	cancel_transfer
I transferred money to a receiver within the EU and they received a lesser amount than expected.  Now I will have to send additional money to the receiver in order to make up the difference.  I'm not sure what went wrong, can you please advise?	transfer_fee_charged
Looks like my card payment was made twice by mistake. I paid at the store earlier which rejected once, second time it worked. App stays at pending for one of the payments. Can you please remove one of them as it's wrong and clearly was declined?	transaction_charged_twice
What should I do about a direct debit that I did not set up?	direct_debit_payment_not_recognised
Can you tell me where I can withdraw money?	atm_support
Which establishments will accept my card?	card_acceptance
Why did I only receive this much currency?	wrong_exchange_rate_for_cash_withdrawal
Is there a fee associated with using foreign exchange ATMs?	wrong_exchange_rate_for_cash_withdrawal
Why is it showing that my account has been charged a dollar that is showing as pending?	extra_charge_on_statement
The card has suffered a security breach.	compromised_card
I accidentally put in the wrong pin too many times and now I need to unblock it. Can you assist with this?	pin_blocked
I bought an item then noticed the exchange rate was wrong.	card_payment_wrong_exchange_rate
There is a transaction showing up several times.	transaction_charged_twice
I paid with my card so so why was I charged a transaction fee?	card_payment_fee_charged
I put money in my account a week ago but its still not there, what is happening?	balance_not_updated_after_cheque_or_cash_deposit
ATM only gave me $20 instead of $100	wrong_amount_of_cash_received
If I need to cash foreign transfers, how does that work?	exchange_rate
Is there somewhere I can send a check to add to my account?	top_up_by_cash_or_cheque
What do I need for activation of my card?	activate_my_card
I bought something on line a and the seller hasn't received the money I sent could you please tell me how long an EU transfer takes?	pending_transfer
My identity can't be verified for some reason	unable_to_verify_identity
While transferring money, its getting error out as my transfer is not possible. Please help me in this as earlier i was able to do it successfully.	beneficiary_not_allowed
Will a beneficiary not accept a transfer?	beneficiary_not_allowed
Why does top-up need to be verified?	verify_top_up
I am getting an error stating my transfer is not possible while transferring money. Let me know the issue as its the first time i am getting error, earlier it used to work.	beneficiary_not_allowed
Why do I see extra charges for withdrawing my money?	cash_withdrawal_charge
I deposited a cheque with some money, but the balance hasn't changed.	balance_not_updated_after_cheque_or_cash_deposit
Am I able to Top Up with Apply Pay?	apple_pay_or_google_pay
Can you tell me why I can't make any transactions?	card_not_working
What value can I get for my currency?	exchange_rate
I'm looking for a machine of yours that will provide me cash from my home country. I went on holiday and don't have any cash on me. Will your machine charge me extra to do this?	wrong_exchange_rate_for_cash_withdrawal
I bought something and I take issue with the exchange rate applied.	card_payment_wrong_exchange_rate
Need to report a change of address.	edit_personal_details
Top-up is loaded into the card and no update.	pending_top_up
How do I check security settings on my card?	card_not_working
Recipient has not received the money	transfer_not_received_by_recipient
I'm wanting to get a Visa card today.	visa_or_mastercard
totally unacceptable.  I'm stranded with no cash because the ATM wouldn't give me any money!	declined_cash_withdrawal
I tried using my ATM card at your Notting Hill location today.  It did not work.  Am I doing something wrong?	declined_cash_withdrawal
I believe my card has been compromised as there are funds showing that I did not receive.	cash_withdrawal_not_recognised
Money was transferred to me and I am unable to see it	pending_transfer
where exactly does money come from	verify_source_of_funds
I've made a transfer, how long until the money reaches my account?	transfer_timing
Will it cost extra to add money to an international card?	top_up_by_card_charge
Would you be able to offer me a discount, since I need to exchange currencies frequently?	exchange_charge
My identity isn't being accepted, what should I do?	unable_to_verify_identity
I tried to purchase airline tickets online this morning and my card information isn't working. Is there something going on with my account?	card_not_working
Please check my Card. As Withdrawal was working fine so far, but this morning suddenly got declined. Can you please check the problem?	declined_cash_withdrawal
I am so angry right now!  I went to the ATM and did not get the correct amount of money I chose to withdraw.  How could this happen?  I need my money and want to know how I can get it ASAP!	wrong_amount_of_cash_received
Do you think you're asking for too much information about me?	why_verify_identity
"""My husband and I went out for our weekly """"dinner and a movie,"""" and it was my turn to pick up the check. Now I see that my card was charged twice. Who should I contact about negating the second charge and getting my card credited?"""	transaction_charged_twice
My money hasn't been deposited yet. When will it be?	pending_top_up
Is this card accepted by ATMs?	atm_support
WHY IS THERE AN EXTRA FEE FOR USING THE ATM??!!!	cash_withdrawal_charge
I didn't think my country-to-country money transfer would take so long. It still says that it's pending so I re-checked all of the account information--everything seems right, so what's the deal?	pending_transfer
How do I go about changing my PIN?	change_pin
There was a direct debit I don't recognize.	direct_debit_payment_not_recognised
What's go on, where is my new card?	card_arrival
I entered a typo when I was transferring money and now I've sent it to an incorrect account.  This is so bad!  I need it cancelled now.	cancel_transfer
I just realised I made the wrong payment yesterday. Can you please change it to the right account? It's my rent payment and really really needs to be in the right account by tomorrow	cancel_transfer
My card is stuck inside the ATM, what am I supposed to do?	card_swallowed
How long will it be to get this new card?	card_arrival
Are there limits on the virtual cards?	disposable_card_limits
|I moved out of my old house two weeks ago and cancelled my direct debit to my old landlord, this direct debit was working fine.  Now I've moved in to a new place and set up a transfer to a new landlord but it's not reached her yet, can you check it please?	transfer_not_received_by_recipient
Tell me how to replace my expired card.	card_about_to_expire
Why hasn't my balance been updated? I've deposited a few cheques some days ago!	balance_not_updated_after_cheque_or_cash_deposit
I forgot what my pin number is and now am blocked can you help me get in?	pin_blocked
My payment is taking a long time to go through.	pending_card_payment
I'm worried my card might be lost in the mail? How long does it usually take to arrive?	card_delivery_estimate
Do cash withdrawals cost anything?	cash_withdrawal_charge
Is the identity check part of bank policy?	why_verify_identity
Are there steps to see where my funds come from?	verify_source_of_funds
I wasn't able to use my card today when I went out for lunch. Wondering why that is?	card_not_working
I got some cash out of the ATM over the holiday and it seems that I've been grossly overcharged. I wouldn't have done that if I knew of these outrageous charges!	wrong_exchange_rate_for_cash_withdrawal
My card was supposed to arrive, but hasn't?	card_arrival
At what age can my children use your service?	age_limit
Is ordering a new card from China available?	card_about_to_expire
How do a reverse a duplicated charge?	transaction_charged_twice
How long do EU transfers take? I bought something online a couple days ago , sent the money immediately online but the seller says it is still not there yet	pending_transfer
I'm having problems making a transfer to another account. I keep getting a declined message. I know that the information I'm putting in is accurate because I have checked it more than once.	declined_transfer
My money disappeared! Please help??	top_up_reverted
I think my pin has been compromised, what do I do?	change_pin
What are age requirements for opening an account?	age_limit
Why hasn't my return cleared my account?	Refund_not_showing_up
Please tell me if I'm going to be charged for sending out more cards?	getting_spare_card
I am 16 and just started working at McDonalds can I deposit my checks at your bank?	age_limit
Do you offer account services for children and teens?	age_limit
Editing my personal details	edit_personal_details
My transfer is pending too long.	balance_not_updated_after_bank_transfer
I wanted to know why my transaction didn't go through.	declined_transfer
I bought a product a week ago, but may need to return it.	request_refund
Is there a longer processing time for international bank transfers?	balance_not_updated_after_bank_transfer
Why would my beneficiary not be allowed?	beneficiary_not_allowed
Can you please tell me why I cant get money from the ATM?	declined_cash_withdrawal
Help, your app is showing a larger WD than I actually did earlier at an ATM.	wrong_amount_of_cash_received
I just got an email in confirming my purchase with my card. I login to the mobile app on the card and found out there are several purchase were made without me aware of it. Evidently someone had stole my card information and made these fraudulent purchase. I need the transaction to be reverse and have my card suspended.	compromised_card
Why is identity verification required?	why_verify_identity
I noticed on my online statement that an ATM withdrawal I made early is still pending.  Is this accurate?	pending_cash_withdrawal
Do you send duplicate cards?	getting_spare_card
Your card pin can be changed at any Visa or MasterCard ATM with Pin services, excluding countries such as Belgium, Luxembourg, Austria, Germany, Spain, and France.	change_pin
The machine didn't work earlier when I went to get money out and now my account says transaction in progress.Why?	pending_cash_withdrawal
My refund for a purchase hasn't  cone through yet.	Refund_not_showing_up
I have used my account abroad for a while without any fees, why am I being charged additional fees all of a sudden?	transfer_fee_charged
